Question,Original Info
Quais são os efeitos colaterais do Zytiga?,"Como todos os medicamentos, este medicamento pode causar efeitos secundários, no entanto estes nãose manifestam em todas as pessoas.Pare de tomar ZYTIGA e dirija-se imediatamente a um médico caso verifique:     Fraqueza nos músculos, espasmos nos músculos ou ritmo irregular do coração (palpitações).      Estes poderão ser sinais de que apresenta níveis baixos de potássio no seu sangue.Outros efeitos secundários incluem:Muito frequentes (podem afetar mais de 1 pessoa em cada 10):Fluidos nas suas pernas ou pés, níveis baixos de potássio no sangue, aumentos nos testes de funçãohepática (do fígado), tensão arterial aumentada, infeção do trato urinário, diarreia.Frequentes (podem afetar menos de 1 pessoa em cada 10):Níveis elevados de gordura no sangue, dor no peito, batimento irregular do coração (fibrilhaçãoauricular), insuficiência cardíaca, ritmo rápido do coração, infeções graves chamadas sepsis, fraturasósseas, indigestão, sangue na urina, erupções na pelePouco frequentes (podem afetar menos de 1 pessoa em cada 100):Problemas nas glândulas suprarrenais (problemas relacionados com sal e água), ritmo do coraçãoanormal (arritmia), fraqueza muscular e/ou dor muscular.Raros (podem afetar até 1 pessoa em cada 1000):Irritação pulmonar (também chamada, alveolite alérgica).Falência da função do fígado (chamada insuficiência hepática aguda).Desconhecidos (não podem ser calculados a partir dos dados disponíveis):Ataque cardíaco, alterações no ECG – eletrocardiograma (prolongamento do intervalo QT) e reaçõesalérgicas graves com dificuldade em engolir ou respirar, face, lábios, língua ou garganta inchados ouerupção na pele com comichão.Pode ocorrer perda óssea em homens tratados para o cancro da próstata. ZYTIGA em combinaçãocom a prednisona ou a prednisolona pode aumentar a perda óssea.Comunicação de efeitos secundáriosSe tiver quaisquer efeitos secundários, incluindo possíveis efeitos secundários não indicados nestefolheto, fale com o seu médico ou farmacêutico. Também poderá comunicar efeitos secundáriosdiretamente através do sistema nacional de notificação mencionado no Apêndice V. Ao comunicarefeitos secundários, estará a ajudar a fornecer mais informações sobre a segurança deste medicamento."
Quais são os efeitos negativos ao tomar Saridon?,"Foram ocasionalmente observadas reações alérgicas da pele (exantema, urticária).Ocorreram, muito raramente, problemas respiratórios ou reações do sistemacirculatório em indivíduos sensíveis (veja a secção “Antes de tomar Saridon N”).Foram notificados casos muito raros de reações cutâneas graves.Se detetar algum destes efeitos indesejáveis, deve interromper o tratamento econsultar o médico.Se algum dos efeitos indesejáveis se agravar ou se detectar quaisquer efeitosindesejáveis não mencionados neste folheto, informe o seu médico ou farmacêutico.Comunicação de efeitos indesejáveisSe tiver quaisquer efeitos indesejáveis, incluindo possíveis efeitos indesejáveis nãoindicados neste folheto, fale com o seu médico ou farmacêutico. Também poderácomunicar efeitos indesejáveis diretamente ao INFARMED I.P. através dos contactosabaixoSítio da internet: http://www.infarmed.pt/web/infarmed/submissaoram(preferencialmente) ou através dos seguintes contactos:Direção de Gestão do Risco de MedicamentosParque da Saúde de Lisboa, Av. Brasil 531749-004 LisboaTel: +351 21 798 73 73Linha do Medicamento: 800222444 (gratuita)E-mail: farmacovigilancia@infarmed.ptAo comunicar efeitos indesejáveis, estará a ajudar a fornecer mais informações sobre asegurança do medicamento."
Em que situações o remédio de Isotretinoína é contraindicado?,"Não tome Isotretinoína Aurovitas Se está grávida ou a amamentar se estiver apta a engravidar, deve seguir as precauções do “Programa de gravideze prevenção”, ver a secção “Advertências e precauções”. Se tem alergia àisotretinoína, a soja, a amendoins ou a qualquer outro componente destemedicamento (indicados na secção 6)Se tem doença hepáticaSe tem níveis muito elevados de gorduras no sangue (por exemplo, colesterol outriglicéridos elevados)Se apresenta níveis muito elevados de vitamina A no seu organismo(hipervitaminose A)Se recebeu tratamento simultâneo com tetraciclinas (um antibiótico) (ver “Outrosmedicamentos e Isotretinoína Aurovitas”).Se isto se aplicar a si, consulte o seu médico antes de tomar qualquer IsotretinoínaAurovitas.Advertências e precauçõesFale com o seu médico ou farmacêutico antes de tomar Isotretinoína AurovitasFale com o seu médico antes de tomar Isotretinoína Aurovitas: Se alguma vez teve problemas de saúde mental, incluindo depressão, tendênciasagressivas ou alterações do humor. Isto porque Isotretinoína Aurovitas pode afetar oseu humor.Programa de prevenção da gravidezMulheres grávidas não devem tomar Isotretinoína AurovitasEste medicamento pode provocar danos sérios no feto (na linguagem médica éteratogénico)- pode causar anomalias graves no cérebro, face, ouvido, olhos,coração e certas glândulas do feto (glândula do timo e glândula paratiróide). Estasanomalias tornam o aborto mais provável. Isto pode acontecer mesmo queIsotretinoína Aurovitas seja tomado apenas durante um curto período de tempodurante a gravidez. Não deve tomar Isotretinoína Aurovitas se está grávida ou sepensa que pode estar grávida. Não deve tomar Isotretinoína Aurovitas se houver a possibilidade de engravidardurante o tratamento. Não deve tomar Isotretinoína Aurovitas se estiver a amamentar. O medicamentopoderá passar para o leite e pode prejudicar o seu bebé. Não deve tomar Isotretínoina Aurovitas se engravidar durante o tratamento. Não deve engravidar durante um mês após ter terminado este tratamento, porqueainda pode restar algum medicamento no seu corpo.Nas mulheres que possam engravidar apenas pode ser prescrito IsotretinoínaAurovitas sob regras restritas, devido ao risco de defeitos congénitos (danos nofeto):Estas são as regras: O seu médico deve explicar o risco teratogénico: deve compreender as razões pelasquais não pode engravidar e o que necessita de fazer para prevenir a gravidez. - Deve falar acerca da contraceção (controle de natalidade) com o seu médico. O seumédico dar-lhe-a informações sobre prevenção da gravidez. Ele ou ela pode encaminhá-la para um especialista para aconselhamento sobre contraceção. Antes de iniciar o tratamento, o seu médico irá pedir-lhe para realizar um teste degravidez. O teste deve mostrar que não está grávida quando começar o tratamento comIsotretinoína Aurovitas.As mulheres devem usar contracetivos eficazes antes, durante e depois de tomarIsotretinoína Aurovitas Deve concordar em usar pelo menos um método de contraceção muito fiável (porexemplo, um dispositivo intra-uterino ou implante contracetivo) ou dois métodos eficazesque funcionam de maneiras diferentes (por exemplo, uma pílula anticoncecionalhormonal e um preservativo). Discuta com seu médico quais métodos seriam adequadospara si. Deve utilizar contraceção no mês anterior à toma de Isotretinoína Aurovitas, durante otratamento e um mês depois da toma.Deve utilizar contraceção, mesmo que não tenha menstruação ou que não tenhaatividade sexual na altura do tratamento (a menos que o seu médico decida que tal nãoé necessário).As mulheres devem concordar com o teste de gravidez antes, durante e depois de tomarIsotretinoína Aurovitas. Deve concordar com visitas de acompanhamento regulares, idealmente a cada mês. Deve concordar em fazer testes de gravidez regulares, idealmente todos os mesesdurante o tratamento e, uma vez que a isotretinoína só é completamente eliminada doorganismo após 1 mês, 1 mês após parar Isotretinoína Aurovitas (a menos que seumédico decida que isso não é necessário no seu caso). Deve concordar com testes extras de gravidez se o seu médico lhe perguntar. Não deve engravidar durante o tratamento nem durante um mês após o término domesmo, porque pode ainda restar algum medicamento no seu corpo. O seu médico irá discutir todos estes pontos consigo, usando uma lista de verificação eirá pedir-lhe (ou a um dos pais / responsável) para assiná-lo. Este formulário confirmaque foi informado sobre os riscos e que seguirá as regras acima.Se engravidar enquanto estiver a tomar Isotretinoína Aurovitas pare de tomar omedicamento imediatamente e contacte o seu médico. Ele ou ela pode encaminhá-lo aum especialista para aconselhamento.Além disso, se engravidar no prazo de um mês após parar de tomar IsotretinoínaAurovitas, deverá contactar o seu médico. O seu médico pode encaminhá-lo a umespecialista para aconselhamento.O seu médico possui informação escrita sobre a prevenção da gravidez para utilizadoresda Isotretinoína Aurovitas a qual lhe deve ser fornecida.. É necessária uma nova prescrição para mais tratamentos. Cada prescrição tem avalidade apenas de 7 dias.Conselhos destinados aos homensOs níveis de retinóide oral no sémen de homens que tomam Isotretinoína Aurovitassão demasiado baixos para prejudicar o feto da sua parceira. No entanto, nuncadeve partilhar a sua medicação com ninguém.Precauções adicionais Nunca deve dar este medicamento a outra pessoa. Por favor leve as cápsulas nãoutilizadas ao seu farmacêutico no final do tratamento. Não deve doar sangue durante o tratamento com este medicamento e durante 1mês após ter parado Isotretinoína Aurovitas porque o feto pode ser afetado se umadoente grávida receber o seu sangue.Problemas de saúde mentalPoderá não se aperceber de algumas mudanças no seu humor e comportamento peloque é muito importante que diga aos seus amigos e família que está a tomar estemedicamento. Eles poderão aperceber-se destas alterações e ajudá-lo a identificarrapidamente quaisquer problemas sobre os quais possa necessitar de falar com o seumédico.Conselhos a todos os doentes Informe o seu médico se já teve alguma doença mental (incluindo depressão,comportamento suicida ou psicose), ou se está a tomar medicamentos para qualqueruma destas condições. Foram notificadas reações cutâneas graves (por exemplo, eritema multiforme,síndrome de Stevens-Johnson e necrólise epidérmica tóxica) com a utilização deisotretinoína. A erupção cutânea pode progredir para bolhas generalizadas oudescamação da pele. Deve estar atenta a úlcerção na boca, garganta, nariz, genitaise conjuntivites (vermelhidão e inchaço nos olhos). Raramente Isotretinoína Aurovitas pode causar reações alérgicas severas, algumasdas quais podem afetar a pele sob a forma de eczema, urticária e hematomas oumanchas vermelhas nos braços e pernas. Se desenvolver uma reação alérgica, parede tomar Isotretinoína Aurovitas e procure aconselhamento médico urgente, einforme-o que está a tomar este medicamento. Reduza o tempo de exercício e atividade fisíca intensa. Isotretinoína Aurovitas podecausar dores musculares e das articulações particularmente em crianças eadolescentes que estão sob atividade fisíca intensa. A Isotretinoína Aurovitas tem sido associada com a doença inflamatória dointestino. O seu médico poderá interromper o tratamento com IsotretinoínaAurovitas se tiver uma diarreia sanguinolenta grave ou história de doençagastrointestinal.-Isotretinoína Aurovitas pode causar secura ocular, intolerância a lentes de contactoe dificuldades visuais, incluindo a diminuição da visão noturna. Fale com o seumédico se tiver alguns destes sintomas. O seu médico pode querer que use umunguento lubrificante oftalmológico ou lágrimas artificiais. Se usar lentes de contactoe desenvolver intolerância a lentes de contacto, pode exigir a utilização de óculosdurante o tratamento. O seu médico pode indicar-lhe um especialista para oaconselhar se desenvolver dificuldades visuais e poderá ter que parar de tomarIsotretinoína Aurovitas. Foi notificada hipertensão intracraniana benigna com a utilização de IsotretinoínaAurovitas e em alguns casos onde Isotretinoína Aurovitas foi utilizada em conjuntocom tetraciclinas (um antibiótico). Pare de tomar Isotretinoína Aurovitas e procureaconselhamento médico urgente se desenvolver alguns destes sintomas como: doresde cabeça, náuseas, vómitos e alteração na sua visão. O seu médico poderá referi-loa um especialista para verificar o inchaço do disco ótico no olho (edema papilar). A Isotretinoína Aurovitas pode aumentar o valor das enzimas hepáticas. O seumédico irá realizar análises sanguíneas, antes, durante e após o tratamento comIsotretinoína Aurovitas, para verificar estes valores. Se estes permanecem elevados,o seu médico pode ter que diminuir a dose ou interromper a toma. A Isotretinoína Aurovitas normalmente aumenta os níveis de gordura no sangue,tais como o colesterol e os triglicéridos. O seu médico irá analisar estes valoresantes, durante e no final do tratamento com Isotretinoína Aurovitas. É melhor nãoingerir bebidas alcóolicas ou pelo menos reduzir a quantidade que normalmenteingere durante o tratamento. Informe o seu médico se já tiver tido níveis elevadosde gordura no sangue, diabetes (açúcar elevado no sangue), se tiver excesso depeso ou consumir álcool em excesso. Pode ser necessário realizar maisfrequentemente análises sanguíneas. Se os níveis de gordura no seu sanguepermanecem elevados, o seu médico pode reduzir a dose ou interromper otratamento com Isotretinoína Aurovitas. Informe o seu médico se tiver problemas renais. No início do tratamento, o seumédico poderá prescrever-lhe a dose mais baixa de Isotretinoína Aurovitas e depoisaumentar para a dose máxima tolerada Informe o seu médico se tiver problemas de intolerância à frutose. O seu médicopoderá não prescrever Isotretinoína Aurovitas se tiver intolerância à frutose ousorbitol. A Isotretinoína Aurovitas pode aumentar os valores de açúcar no sangue. Em casosraros, as pessoas tornam-se diabéticas. O seu médico pode monitorizar os valores deaçúcar no sangue durante o tratamento, especialmente se já tem diabetes, excessode peso ou consome álcool em excesso. É provável que a sua pele fique seca. Utilize um creme ou pomada hidratante napele e um baton hidratante nos lábios durante o tratamento. Para prevenir a irritaçãoda pele deve evitar o uso de esfoliantes ou produtos anti-acne. Evite a exposição prolongada ao sol e não utilize a lâmpadas de U.V. ou solários. Asua pele pode tornar-se mais sensível à luz solar. Antes de se expor ao sol apliqueum protetor solar com um elevado fator de proteção (SPF 15 ou superior).Não utilize qualquer tratamento cosmético. Isotretinoína Aurovitas pode fragilizar asua pele. Não utilize qualquer cera (depilação), tratamentos de dermoabrasão oucom laser (remoção da camada córnea da pele ou de cicatrizes) durante otratamento, ou durante pelo menos 6 meses após o tratamento uma vez que istopode originar cicatrizes, irritação da pele, ou raramente, alterações na cor da suapele..Crianças e adolescentesA utilização de Isotretinoína Aurovitas em crianças com idade inferior a 12 anos nãoé recomendada. Isto deve-se ao fato de não ser conhecido se é seguro ou eficazneste grupo etário. Utilizar apenas em adolescentes com mais de 12 anos de idadeapós a puberdadeOutros medicamentos e Isotretinoína AurovitasInforme o seu médico ou farmacêutico se estiver a tomar, tiver tomadorecentemente, ou se vier a tomar outros medicamentos, incluindo medicamentos àbase de plantas e medicamentos não sujeitos a receita médica. Não tome suplementos com vitamina A ou tetraciclinas (um antibiótico), ou utilizequalquer tratamento para o acne enquanto estiver a tomar Isotretinoína Aurovitas.Pode utilizar cremes hidratantes e emolientes (cremes para a pele ou preparaçõesque impedem a perda de água e têm um efeito suavizante na pele).Evite o uso de queratolíticos tópicos ou agentes exfoliantes anti-acne quando estivera tomar Isotretinoína Aurovitas.Gravidez, amamentação e fertilidadeSe está grávida ou a amamentar, se pensa estar grávida ou planeia engravidar,consulte o seu médico antes de tomar este medicamento.Para mais informações sobre contraceção, gravidez e amamentação, consulte asecção 2 “Programa de prevenção da gravidez”.Condução de veículos e utilização de máquinasA sua visão noturna pode ficar comprometida durante o tratamento. Isto podeacontecer subitamente. Em casos raros, este efeito continuou após a interrupção dotratamento. Foram muito raramente notificadas sonolência e tonturas. Se isto seaplicar a si, não deve conduzir nem utilizar máquinas.Isotretinoína Aurovitas contém óleo de soja, o agente corante Ponceau 4R e sorbitol:Óleo de soja: Isotretinoína Aurovitas contém óleo de soja. Se é alérgico aosamendoins ou à soja, não utilize este medicamento.Ponceau 4R (E124): Agente corante que pode provocar reações alérgicas.Sorbitol (E420): se o seu médico o informou que tem intolerância a alguns açúcares,contacte-o antes de tomar este medicamento.Este medicamento contém menos de 1 mmol de sódio (23 mg) por cada 10 mg e 20mg de cápsulas moles, isto é, essencialmente ""isento de sódio""."
Qual é a dose recomendada de Citalopram Genedec?,"A dose recomendada é:AdultosTratamento da depressãoA dose habitual é de 20 mg por dia. O seu médico pode aumentar esta dose até ummáximo de 40 mg por dia.Tratamento das perturbações de pânicoA dose para a primeira semana de tratamento é de 10 mg por dia, antes de se aumentar adose para 20-30 mg por dia. A dose pode ser aumentada até um máximo de 40 mg pordia.Doentes idosos (acima dos 65 anos de idade):A dose inicial deve ser reduzida para metade da dose recomendada, ou seja, entre 10-20mg por dia. Os idosos não devem tomar mais de 20 mg por dia.Função hepática reduzidaOs doentes com uma função hepática ligeiramente a moderadamente reduzida deverãoreceber uma dose inicial de 10 mg por dia. A dose diária não deverá exceder 20 mg.São aconselhadas precaução e uma posologia muito cuidadosa em doentes com umafunção hepática gravemente reduzida.Os doentes com uma função hepática reduzida deverão ser clinicamente monitorizados.Função renal reduzidaO médico poderá decidir receitar uma dose inferior à descrita acima.Em doentes com compromisso renal grave, a utilização de Citalopram não érecomendada, pois não está disponível informação sobre a utilização nesses doentes.Utilização em crianças e adolescentes com menos de 18 anos de idade:Citalopram Genedec não deverá ser utilizado no tratamento de crianças e adolescentescom menos de 18 anos de idade (ver “Advertências e Precauções”).Citalopram Genedec 40 mg comprimidos revestidos por película:Se a dose não puder ser alcançada com estes comprimidos estão disponíveis outrasdosagens do medicamento.Utilização oral.Tome este medicamento exatamente como indicado pelo seu médico ou farmacêutico.Fale com o seu médico ou farmacêutico se tiver dúvidas.Citalopram Genedec deverá ser tomado numa toma única, de manhã ou à noite. Oscomprimidos podem ser tomados com ou sem alimentos.Citalopram Genedec 10 mg comprimidos revestidos por películaOs comprimidos deverão ser engolidos inteiros com um copo de água ou de outrolíquido.Citalopram Genedec 20 mg e 40 mg comprimidos revestidos por películaOs comprimidos ou as metades dos comprimidos deverão ser engolidos inteiros comum copo de água ou de outro líquido.Duração do tratamento:Citalopram Genedec não funciona imediatamente. Poderá demorar 2-4 semanas antesde sentir algum benefício destes comprimidos. Isto é normal para este tipo demedicamento.Para o tratamento das perturbações de pânico a resposta terapêutica completa poderádemorar até 3 meses a desenvolver-se. Poderá ser necessário continuar o tratamentodurante vários meses.Continue a tomar os comprimidos enquanto o seu médico o recomendar. Não deixe detomá-los mesmo que se comece a sentir melhor, a menos que o seu médico lhe digapara o fazer. Nunca altere a dose do seu medicamento sem falar primeiro com o seumédico.Sintomas de abstinência observados com a suspensãoA interrupção abrupta deverá ser evitada. Quando parar o tratamento com Citalopram adose deverá ser gradualmente reduzida ao longo de períodos de uma a duas semanas, demodo a reduzir o risco de reações de abstinência (ver secção “Se parar de tomarCitalopram Genedec” e “Efeitos indesejáveis possíveis”).Se tiver a impressão de que o efeito de Citalopram é demasiado forte ou demasiadofraco, fale com o seu médico ou farmacêutico.Se tomar mais Citalopram Genedec do que deveriaSe tiver tomado mais Citalopram do que deveria, fale imediatamente com um médicoou farmacêutico.Sintomas em caso de sobredosagem:Sonolência, inconsciência, convulsões, batimentos cardíacos lentos/acelerados,tonturas, alterações no ritmo do coração (p. ex., intervalo QT prolongado), pressãoarterial baixa/alta, tremores, desmaios, náuseas, vómitos, transpiração, agitação, febrealta, paragem cardíaca, dilatação das pupilas, estado mental alterado, coloração azuladada pele devido a uma quantidade inadequada de oxigénio no sangue (cianose),hiperventilação. Poderão ocorrer características da síndroma da serotonina (ver “Efeitosindesejáveis possíveis”), particularmente quando são co-ingeridas outras substâncias.Caso se tenha esquecido de tomar Citalopram GenedecNão tome uma dose a dobrar para compensar uma dose que se esqueceu de tomar.Se parar de tomar Citalopram GenedecNão pare de tomar Citalopram Genedec a menos que o seu médico lhe diga para ofazer.Dado que poderão ocorrer reações de abstinência quando o tratamento é interrompido, éaconselhável reduzir a dose gradualmente a intervalos de 1-2 semanas.As reações de abstinência incluem: tonturas, formigueiros ou entorpecimento, dores decabeça, náuseas e ansiedade. Na sua maioria as reações de abstinência são de naturezaligeira e auto-limitada. Se o tratamento estiver a ser parado, é aconselhável que a doseseja gradualmente reduzida ao longo de períodos de 1-2 semanas.Caso ainda tenha dúvidas sobre a utilização deste medicamento, fale com o seu médicoou farmacêutico."
Como devo armazenar o Rivotril?,"Conservar na embalagem de origem para proteger da luz.Manter este medicamento fora da vista e do alcance das crianças.Não utilize este medicamento após o prazo de validade impresso na embalagem exterior, após""VAL."". O prazo de validade corresponde ao último dia do mês indicado.Não deite fora quaisquer medicamentos na canalização ou no lixo doméstico. Pergunte ao seufarmacêutico como deitar fora os medicamentos que já não utiliza. Estas medidas ajudarão aproteger o ambiente."
