Question,Original Info
Em que situações não devo tomar Lorazepam Pharmakern?,"Não tome Lorazepam Pharmakern:Se tem alergia ao lorazepam ou a outra benzodiazepina, ou a qualquer outro componentedeste medicamento (indicados na secção 6).Se tiver miastenia gravis (músculos muito fracos ou cansados).Se tiver insuficiência respiratória grave.Se tiver síndrome da apneia do sono (interrupção da respiração durante o sono).Se tiver insuficiência hepática grave.Advertências e precauçõesTome especial cuidado:Se tem a função hepática ou renal alterada.Se tiver glaucoma de ângulo fechado.Após o uso contínuo durante algumas semanas, pode observar-se perda gradual deeficácia em relação aos efeitos hipnóticos.Tal como acontece com outras benzodiazepinas, o tratamento com lorazepam podeprovocar dependência física e psíquica; o risco de dependência aumenta com a dose e aduração do tratamento, sendo maior em doentes que tenham consumido drogas ou álcool.Uma vez desenvolvida dependência física, a interrupção brusca do tratamento podecausar sintomas de abstinência, tais como, dores de cabeça, dores musculares, ansiedadeacentuada, tensão, intranquilidade, confusão e irratibilidade. Em casos graves podem serapresentados os seguintes sintomas: despersonalização, hiperacusia (acuidade anormal daaudição), formigueiro e cãibras nas extremidades, intolerância à luz, aos sons e aocontacto físico, alucinações e convulsões.Após a interrupção do medicamento, principalmente se interromper bruscamente, podemaparecer insónias de recorrência (efeito rebound) e ansiedade, alterações de humor eintranquilidade, por isso recomenda-se a diminuição gradual da dose antes de abandonaro tratamento.A duração do tratamento deve ser a mais curta possível (ver secção 3), não devendoprolongar o tratamento sem que o seu médico lho indique.As benzodiazepinas podem induzir uma alteração da memória recente (amnésiaanterógrada), esta situação ocorre mais frequentemente depois de várias horas após atoma do medicamento assim, para diminuir o risco associado deverá assegurar-se de queirá poder dormir de forma ininterrupta durante 7-8 horas após a toma do comprimido (versecção 4).As benzodiazepinas podem produzir reações psiquiátricas e paradoxais, tais comointranquilidade, agitação, irritabilidade, agressividade, delírios, ataques de ira, pesadelos,alucinações, psicoses, comportamento inadequado e outros efeitos adversos sobre ocomportamento. Caso isto ocorra, dever-se-á suspender o tratamento. Estas reações sãomais frequentes em crianças e idosos.As benzodiazepinas não devem ser utilizadas sozinhas no tratamento da ansiedadeassociada à depressão (risco de suicídio).As benzodiazepinas devem ser utilizadas com a máxima precaução em doentes quetenham consumido ou consumam drogas ou álcool.Crianças e adolescentesTal como com outras benzodiazepinas, não se deve administrar Lorazepam Pharmakern acrianças, a não ser que seja estritamente necessário. A duração do tratamento deve ser amenor possível.A segurança e a eficácia de lorazepam em indivíduos com idade inferior a 18 anos nãoforam estabelecidas, pelo que não se recomenda a sua utilização.IdososTal como com outras benzodiazepinas, as pessoas de idade avançada podem ser maissensíveis aos efeitos de Lorazepam Pharmakern do que os outros adultos, pelo quedeverão tomar uma dose menor.Doentes com insuficiência respiratóriaRecomenda-se igualmente a utilização de doses menores em doentes com insuficiênciarespiratória crónica pelo risco associado de depressão respiratória, como por exemplo emdoentes com doença pulmonar obstrutiva crónica (DPOC) ou síndrome da apneia dosono.Outros medicamentos e Lorazepam PharmakernInforme o seu médico ou farmacêutico se estiver a tomar, tiver tomado recentemente, ouse vier a tomar outros medicamentos.Tal como ocorre com outras benzodiazepinas, Lorazepam Pharmakern pode interferircom alguns medicamentos, em especial com os depressores do sistema nervoso central.Pode produzir-se uma potenciação do efeito depressor sobre o sistema nervoso central,desenvolvendo mais sonolência do que deveria, ao administrar Lorazepam Pharmakernjuntamente com: Medicamentos utilizados para o tratamento de doenças mentais (antipsicóticos,hipnóticos, ansiolíticos/sedantes, antidepressivos). Medicamentos utilizados para aliviar a dor forte (analgésicos narcóticos). Fármacos utilizados para o tratamento de convulsões ou ataques epiléticos(medicamentos antiepiléticos). Anestésicos e barbitúricos. Medicamentos utilizados para o tratamento de alergias (anti-histamínicos sedantes).No caso dos analgésicos narcóticos também se pode produzir um aumento da sensação deeuforia, o que pode aumentar a dependência psíquica.A administração conjunta de lorazepam com outros medicamentos como clozapina,valproato, probenecida, teofilina ou aminofilina podem alterar o efeito de lorazepamprolongando ou diminuindo a sua atividade.Lorazepam Pharmakern com alimentos, bebidas e álcoolLorazepam Pharmakern não deve ser administrado em combinação com bebidasalcoólicas, uma vez que estas podem potenciar o efeito sedante do medicamento, o quepode afetar a capacidade de conduzir ou utilizar máquinas.Gravidez e amamentaçãoConsulte o seu médico antes de utilizar qualquer medicamento.Se está a tomar Lorazepam Pharmakern e planeia engravidar ou descobriu que estágrávida, deve contactar o seu médico para proceder à interrupção do medicamento.As crianças que nascem de mães que tomam benzodiazepinas de forma crónica durante oúltimo período da gravidez, podem desenvolver dependência física, podendo desencadeara síndrome de abstinência no período pós-natal.Dado que as benzodiazepinas passam para o leite materno, deve evitar-se a toma destemedicamento durante a amamentação.Condução de veículos e utilização de máquinasA capacidade para conduzir veículos e utilizar máquinas pode ser prejudicada pelasedação, amnésia, dificuldade de concentração e função muscular comprometida, quepodem aparecer como consequência do tratamento. Além disso, os períodos de sonoinsuficientes podem aumentar a deterioração do estado de alerta.Lorazepam Pharmakern contém lactose mono-hidratada. Se foi informado pelo seumédico que tem intolerância a alguns açúcares, contacte-o antes de tomar estemedicamento."
Quais são os efeitos colaterais do Rytmonorm?,"Como todos os medicamentos, este medicamento pode causar efeitos secundários,embora estes não se manifestem em todas as pessoas.Efeitos secundários notificados em ensaios clínicos ou pós-comercialização:Os efeitos secundários que se seguem, descritos por ordem decrescente de gravidadedentro de cada classe de frequência, foram notificados com esta ou outras formulaçõesde cloridrato de propafenona.Muito frequentes (em mais de 1 em 10 doentes):Tonturas (excluindo vertigem), alterações de condução cardíaca (incluindo bloqueiossinoauricular, auriculoventricular e intraventricular) e palpitações.Frequentes (em mais de 1 em 100 doentes mas menos de 1 em 10 doentes):Ansiedade, alterações de sono, cefaleias, disgeusia, visão turva, bradicardia sinusal,bradicardia, taquicardia, fibrilhação auricular, dispneia, dor abdominal, vómitos,náuseas, diarreia, obstipação, secura da boca, disfunções hepáticas (elevação dos níveisde aspartato aminotransferase, alanina aminotransferase, gama-glutamil transferase efosfatase alcalina sanguínea), dor torácica, astenia, fadiga e pirexia.Pouco frequentes (em mais de 1 em 1.000 doentes mas menos de 1 em 100 doentes):Trombocitopenia, diminuição do apetite, pesadelos, síncope, ataxia, parestesia,vertigens, taquicardia ventricular, arritmia, hipotensão, distensão abdominal,flatulência, urticária, prurido, erupção cutânea, eritema e disfunção erétil.Desconhecido (com frequência não conhecida):Agranulocitose, leucopenia, granulocitopenia, hipersensibilidade (pode manifestar-sepor colestase, discrasia sanguínea e exantema), confusão, convulsões, sintomasextrapiramidais, inquietação, fibrilhação ventricular, insuficiência cardíaca, redução dafrequência cardíaca, hipotensão ortostática, regurgitação, perturbações gastrointestinais,lesão hepatocelular, colestase, hepatite, icterícia, síndrome tipo-lúpus e redução dacontagem de esperma (a redução da contagem de esperma é reversível após adescontinuação da propafenona).Comunicação de efeitos secundáriosSe tiver quaisquer efeitos secundários, incluindo possíveis efeitos secundários nãoindicados neste folheto, fale com o seu médico ou farmacêutico. Também poderácomunicar efeitos secundários diretamente ao INFARMED, I.P. através dos contactosabaixo. Ao comunicar efeitos secundários, estará a ajudar a fornecer mais informaçõessobre a segurança deste medicamento.INFARMED, I.P.Direção de Gestão do Risco de MedicamentosParque da Saúde de Lisboa, Av. Brasil 531749-004 LisboaTel: +351 21 798 71 40Fax: + 351 21 798 73 97Sítio da internet: http://extranet.infarmed.pt/page.seram.frontoffice.seramhomepageE-mail: farmacovigilancia@infarmed.pt"
Quais são os efeitos negativos ao tomar Campral?,"Como todos os medicamentos, este medicamento pode causar efeitos secundários,embora estes não se manifestem em todas as pessoas.É importante que saiba o que pode eventualmente ocorrer para poder agir de imediato nocaso de aparecimento de efeitos secundários.Caso tenha reações na pele, contacte de imediato o seu médico ou farmacêutico.Os efeitos secundários estão listados abaixo, de acordo com a frequência com que podemocorrer:Muito frequentes (podem afetar mais de 1 em cada 10 pessoas): DiarreiaFrequentes (podem afetar até 1 em 10 pessoas): Diminuição da líbido Dor de estômago Náuseas Vómitos Flatulência Prurido (comichão) Rash maculopapular (erupção na pele caracterizada pela presença de máculas e depápulas) Frigidez ou impotênciaPouco frequentes (podem afetar até 1 em 100 pessoas): Aumento da líbidoMuito raros (podem afetar até 1 em 10.000 pessoas): Reações de hipersensibilidade, incluindo urticária, angioedema ou reações anafiláticas.Desconhecidos (não pode ser calculado a partir dos dados disponíveis): Erupções vesiculo-bolhosasComunicação de efeitos secundáriosSe tiver quaisquer efeitos secundários, incluindo possíveis efeitos secundários nãoindicados neste folheto, fale com o seu médico ou farmacêutico. Também poderácomunicar efeitos secundários diretamente ao INFARMED, I.P. através dos contactosabaixo. Ao comunicar efeitos secundários, estará a ajudar a fornecer mais informaçõessobre a segurança deste medicamento.INFARMED, I.P.Direção de Gestão do Risco de MedicamentosParque da Saúde de Lisboa, Av. Brasil 531749-004 LisboaTel: +351 21 798 73 73Linha do Medicamento: 800222444 (gratuita)Fax: + 351 21 798 73 97Sítio da internet: http://www.infarmed.pt/web/infarmed/submissaoramE-mail: farmacovigilancia@infarmed.pt"
Em que situações o remédio de Propycil é contraindicado?,"Não tome Propycil: Se tem alergia (hipersensibilidade) ao propiltiouracilo ou a qualquer outrocomponente de Propycil. Se teve efeitos indesejáveis graves quando utilizou medicamentos que continhampropiltiouracilo, particularmente perda de glóbulos brancos (agranulocitose) e lesãoinflamatória do fígado.Tome especial cuidado com Propycil se apresentar uma das seguintes doenças:É necessário que o seu médico tome especial atenção e realize uma avaliaçãocuidadosa se a contagem das suas células sanguíneas não estiver normal, se tiverproblemas hepáticos (aumento das enzimas do fígado) ou se tiver problemas nofluxo da bílis (colestase).Confirme com o seu médico se o seguinte se aplica ao seu caso:Alguns casos de reacções hepáticas graves, incluindo casos fatais e casos queobrigaram a transplante do fígado, foram notificados, tanto em adultos como emcrianças tratadas com propiltiouracilo.Deve informar imediatamente o seu médico se desenvolver sintomas de doençahepática, tais como: náuseas, sensação de enjoo, diarreia, coloração amarelada dapele ou olhos, urina escura, fezes claras, sangrar facilmente, comichão ou arrepios.No caso do aumento da glândula da tiróide afectar a traqueia deve-se administrarPropycil durante um período curto de tempo e sob cuidadosa vigilância.Propycil só deve ser utilizado em crianças apenas se todas as outras medidasdisponíveis para controlar a função tiroideia tiverem falhado.Ao tomar Propycil com outros medicamentos:Informe o seu médico ou farmacêutico se estiver a tomar ou tiver tomadorecentemente outros medicamentos, incluindo medicamentos obtidos sem receitamédica.Quais os outros medicamentos que influenciam o Propycil?A administração de tiroxina reduz a absorção do Propycil pela glândula da tiróide econsequentemente requer uma redução na síntese da hormona endógena, sendo porisso necessário uma dose mais elevada de Propycil para obter sucesso notratamento.A actividade anti-tiroideia do Propycil pode ser reduzida se for administrado iodoconcomitantemente ou se tiverem sido administrados previamente medicamentoscontendo iodo ou um meio de contraste de raio X. Nestas circunstâncias pode levarmais tempo que o habitual até se atingir o efeito terapêutico.Quais são os outros medicamentos que podem ser influenciados pelo Propycil:O tratamento com Propycil pode influenciar a fracção efectiva (não ligada àsproteínas) do propranolol e dos derivados da cumarina, de tal forma que pode sernecessário um ajuste da dose.Gravidez e aleitamento:Consulte o seu médico ou farmacêutico antes de tomar qualquer medicamento.GravidezO potencial de Propycil 50 mg comprimidos para causar danos no feto (anomaliascongénitas) é desconhecido.Se está grávida, se pensa estar grávida ou planeia engravidar, informeimediatamente o seu médico. Pode necessitar de tratamento com Propycil 50 mgcomprimidos durante a gravidez se o potencial benefício for superior ao potencialrisco para si e para o feto.Durante a gravidez a dose de Propycil deve ser a mais baixa possível de forma aevitar o aborto e o hipotiroidismo e bócio do feto. Durante este período é obrigatóriauma vigilância cuidadosa. A produção de hormona fetal inicia-se entre a 10ª e 14ªsemana de gravidez.Durante a terapêutica com Propycil o aleitamento é possível. A dose de Propycil deveser baixa (150mg por dia). É necessária uma vigilância especial do recém-nascido,dado que foram reportados casos isolados de hipotiroidismo no recém-nascido. Acombinação de Propycil e da tiroxina durante a gravidez e o aleitamento não érecomendada.Condução de veículos e utilização de máquinas:Deve verificar se os sintomas da sua doença da tiróide ou os efeitos indesejáveispotenciais do Propycil podem afectar a condução de veículos e utilização demáquinas.Informações importantes sobre alguns componentes de Propycil:Este medicamento contém lactose mono-hidratada. Se foi informado pelo seu médicoque tem intolerância a alguns açúcares, contacte-o antes de tomar estemedicamento."
Magnesona pode causar sonolência ou afetar minha habilidade de operar veículo?,"Como todos os medicamentos, a Magnesona pode causar efeitos secundários, emboraestes não se manifestem em todas as pessoas.Pouco frequentes (podem afetar até 1 em 100 pessoas)Fezes moles ou diarreia, dores abdominaisDesconhecida (a frequência não pode ser estimada com os dados disponíveis)Náuseas, vómitos; reações cutâneas do tipo alérgico como por exemplo vermelhidão dapele (eritema), comichão (urticária), inchaço da pele (angioedema).Foi descrito um caso de tonturas e desequilíbrio com Magnesona.Comunicação de efeitos secundáriosSe tiver quaisquer efeitos secundários, incluindo possíveis efeitos secundários nãoindicados neste folheto, fale com o seu médico, farmacêutico ou enfermeiro. Tambémpoderá comunicar efeitos secundários diretamente ao INFARMED, I.P. através doscontactos abaixo. Ao comunicar efeitos secundários, estará a ajudar a fornecer maisinformações sobre a segurança deste medicamento.INFARMED, I.P.Direção de Gestão do Risco de MedicamentosParque da Saúde de Lisboa, Av. Brasil 531749-004 LisboaTel: +351 21 798 73 73Linha do Medicamento: 800222444 (gratuita)Fax: +351 21 798 73 97Sítio da internet: http://extranet.infarmed.pt/page.seram.frontoffice.seramhomepageE-mail: farmacovigilancia@infarmed.pt"
Quais são possíveis efeitos colaterais gastrointestinais de Magnesona?,"Como todos os medicamentos, a Magnesona pode causar efeitos secundários, emboraestes não se manifestem em todas as pessoas.Pouco frequentes (podem afetar até 1 em 100 pessoas)Fezes moles ou diarreia, dores abdominaisDesconhecida (a frequência não pode ser estimada com os dados disponíveis)Náuseas, vómitos; reações cutâneas do tipo alérgico como por exemplo vermelhidão dapele (eritema), comichão (urticária), inchaço da pele (angioedema).Foi descrito um caso de tonturas e desequilíbrio com Magnesona.Comunicação de efeitos secundáriosSe tiver quaisquer efeitos secundários, incluindo possíveis efeitos secundários nãoindicados neste folheto, fale com o seu médico, farmacêutico ou enfermeiro. Tambémpoderá comunicar efeitos secundários diretamente ao INFARMED, I.P. através doscontactos abaixo. Ao comunicar efeitos secundários, estará a ajudar a fornecer maisinformações sobre a segurança deste medicamento.INFARMED, I.P.Direção de Gestão do Risco de MedicamentosParque da Saúde de Lisboa, Av. Brasil 531749-004 LisboaTel: +351 21 798 73 73Linha do Medicamento: 800222444 (gratuita)Fax: +351 21 798 73 97Sítio da internet: http://extranet.infarmed.pt/page.seram.frontoffice.seramhomepageE-mail: farmacovigilancia@infarmed.pt"
Salagen pode ser utilizado por pessoas com histórico de problemas cardíacos ou respiratórios?,"Não tome Salagen se tem alergia (hipersensibilidade) ao cloridrato de pilocarpina ou a qualquer outrocomponente de Salagen (indicados na secção 6) se sofre de asma não tratada se tem uma doença cardíaca ou renal não tratada se tem uma doença crónica que esteja a ser tratada com um medicamento queatue como Salagen se tem uma inflamação da íris do olho (irite).Se alguma destas situações se aplica a si, informe o seu médico antes de tomarSalagen.Advertências e precauçõesFale com o seu médico ou farmacêutico antes de tomar Salagen.Informe o seu médico antes de tomar Salagen se tem: problemas pulmonares (por ex.: asma, bronquite crónica e/ou doença pulmonarobstrutiva crónica) problemas cardíacos (por ex.: insuficiência cardíaca, pulso irregular) problemas de vesícula (por ex.: cálculos biliares) problemas de estômago (por ex.: úlceras) problemas hepáticos (por ex.: função hepática diminuída) problemas do sistema nervoso/mentais problemas renais (por ex.: insuficiência renal ou cálculos renais) problemas oculares (por ex.: glaucoma de ângulo fechado).Exames ocularesO seu médico pode querer efetuar exames aos seus olhos antes do início dotratamento. Se não fez exames aos seus olhos recentemente, informe o seu médico.Sudação excessivaSe transpirar excessivamente durante o tratamento com Salagen, beba maislíquidos. Se isso não ajudar, contacte o seu médico pois pode sofrer de desidrataçãoe danos nos órgãos se tal continuar.Outros medicamentos e SalagenInforme o seu médico ou farmacêutico se estiver a tomar ou tiver tomadorecentemente outros medicamentos, incluindo medicamentos obtidos sem receitamédica.É especialmente importante que informe o seu médico se estiver a tomar quaisquermedicamentos para tratar: pressão arterial elevada, problemas cardíacos ou problemas oculares (por ex.: umbeta-bloqueante) diarreia (por ex.: atropina) asma (por ex.: ipratrópio inalado)Gravidez, amamentação e fertilidadeGravidezNão use Salagen durante a gravidez, a não ser que o seu médico o recomende.Se está, ou pensa que pode estar, grávida, informe o seu médico antes de tomarSalagen.AleitamentoNão use Salagen se estiver a amamentar.Consulte o seu médico antes de tomar qualquer medicamento.Fertilidade masculinaSe está a planear ser pai de uma criança, fale com o seu médico paraaconselhamento antes de tomar este medicamento.Condução de veículos e utilização de máquinasSalagen pode causar tonturas ou afetar sua visão, em particular, você pode terproblemas em ver bem à noite. Se isso acontecer, não conduza nem use ferramentasou máquinas."
Como posso conservar o Pipermel?,"Manter fora do alcance e da vista das crianças.Embalagem fechada: Conservar a temperatura inferior a 30ºC. Conservar ao abrigo da luze da humidadePrazo de validade após abertura do frasco: Conservar a temperatura inferior a 30ºC.Conservar ao abrigo da luz e da humidade.Após a primeira abertura do frasco, o prazo de validade é de 3 meses.Não utilize Pipermel após o prazo de validade impresso no rótulo do frasco e naembalagem exterior a seguir a “Val”. O prazo de validade corresponde ao último dia domês indicado.Os medicamentos não devem ser eliminados na canalização ou no lixo doméstico.Pergunte ao seu farmacêutico como eliminar os medicamentos de que já não necessita.Estas medidas irão ajudar a proteger o ambiente."
Qual é a composição de Combantrin?,"Qual a Composição de CombantrinA substância activa é Pamoato de Pirantel. Cada ml de suspensão oral contémpamoato de pirantel equivalente a 50 mg de pirantel.Os outros componentes são: Silicato de Alumínio e Magnésio, Benzoato de Sódio,Lecitina, Essência de Caramelo, Aroma de Groselha, Polissorbato 80, Solução deSorbitol a 70%, Glicerol a 99,5%, Povidona K 25, Simeticone, Ácido Cítrico mono-hidratado, Água purificada.Qual o aspecto de Combantrin e o conteúdo da embalagemEmbalagens com 1 frasco de vidro âmbar de 15 ml de suspensão oral e uma colher-medida de 5 ml.A suspensão oral apresenta um sabor a caramelo e groselha que lhe é conferidopelas essências de caramelo e groselha que entram na composição do medicamento.Não contém sacarose nem lactose."
Para que serve Benadon?,"Benadon contém vitamina B6 (cloridrato de piridoxina), a qual pertence aos grupos dasvitaminas hidrossolúveis.Este medicamento está indicado para prevenir carências de vitamina B6."
Como devo tomar Feldene?,"Utilize este medicamento exatamente como indicado pelo seu médico ou farmacêutico.Fale com o seu médico ou farmacêutico se tiver dúvidas.Feldene destina-se, exclusivamente, a uso externo (aplicação na pele).Posologia UsualAplicar, na área afetada cerca de 1 grama de gel (cerca de 3 cm de comprimento de gel,quando pressionada a sua saída do tubo), e massajar, suavemente, até completaabsorção do gel, três ou quatro vezes ao dia.Não deve ser utilizado penso oclusivo.Lavar as mãos após cada aplicação.Caso restem sobre a pele resíduos de medicamento, poderá ocorrer descoloração da peleligeira e passageira (ver Efeitos Secundários Possíveis), assim como manchas na roupa.CriançasNão foram estabelecidas indicações nem doses a utilizar em Pediatria. A utilização deFeldene em crianças apenas deverá ser feita sob prescrição e controlo médico.Idosos, doentes com insuficiência hepática ou renalA administração de Feldene a idosos, doentes com insuficiência hepática e doentes cominsuficiência renal não requer ajuste posológico ou cuidados especiais na administração.Momento Mais Favorável à AdministraçãoDe manhã ao levantar, à noite ao deitar e mais uma ou duas vezes durante o dia.Duração Média do TratamentoNas dores relacionadas com entorses deverá começar a sentir melhoria na primeirasemana de tratamento. Se a dor não melhorar após uma semana, consulte o seu médicoou farmacêutico.Não utilize Feldene por um período de tempo superior a 4 semanas sem consultar o seumédico.O seu médico irá definir a duração do tratamento consoante a situação a tratar.Se utilizar mais Feldene do que deveriaNão é provável que ocorra sobredosagem com Feldene.Caso se tenha esquecido de aplicar Feldene:Se se esquecer de aplicar Feldene faça-o logo que se lembrar e continue o tratamentoconforme estava previsto.Não tome uma dose a dobrar para compensar uma dose que se esqueceu de tomar.Caso ainda tenha dúvidas sobre a utilização deste medicamento, fale com o seu médicoou farmacêutico."
