Question,Original Info
Alipza pode ser aplicado a pessoas com histórico de doenças hepáticas?,"Não tome Alipzase tem alergia (hipersensibilidade) à pitavastatina, a qualquer outra estatina ou aqualquer outro componente de Alipza (indicados na secção 6.).se está grávida ou a amamentar.se é uma mulher que pode ter filhos e não está a utilizar um método contracetivofiável (ver “Gravidez e aleitamento”).se tem atualmente problemas de fígado.se toma ciclosporina - utilizada após um transplante de órgãos.se tem uma sensação dolorosa ou dores repetidas ou inexplicadas nos músculos.Se tiver dúvidas fale com o seu médico ou farmacêutico antes de tomar Alipza.Advertências e precauçõesFale com o seu médico ou farmacêutico antes de tomar Alipza,se tem uma insuficiência respiratória grave (problemas respiratórios graves).se já teve problemas nos rins,se teve anteriormente problemas de fígado. As “estatinas” podem afetar o fígadonum pequeno número de pessoas. Normalmente o seu médico efetuará uma análiseao sangue (provas da função hepática) antes e durante o tratamento com Alipza.se já teve problemas da glândula tiróide.se tem, ou um dos seus familiares tem antecedentes de problemas musculares.se já teve história anterior de problemas musculares ao tomar outros medicamentospara baixar o colesterol (por exemplo, estatinas ou fibratos).se beber uma quantidade excessiva de bebidas alcoólicas.se estiver a tomar ou tiver tomado nos últimos 7 dias um medicamento chamadoácido fusídico (um medicamento para infeções bacterianas) por via oral ou porinjeção. A associação de ácido fusídico e Pitavastatina pode levar a problemasmusculares graves (rabdomiólise).Se qualquer um dos acima mencionados se aplicar a si (ou se não tiver a certeza),fale com o seu médico ou farmacêutico antes de tomar Alipza. Informe igualmente oseu médico ou farmacêutico se sofre de fraqueza muscular constante. Podem sernecessários exames e medicamentos adicionais para diagnosticar e tratar estadoença.Enquanto estiver a tomar este medicamento o seu médico irá monitorizá-loatentamente caso tenha diabetes ou estiver em risco de vir a desenvolver diabetes.É provável que esteja em risco de vir a desenvolver diabetes se tiver níveis elevadosde açúcar e gordura no sangue, excesso de peso e apresentar tensão arterialelevada.Crianças e adolescentesAlipza não deve ser administrado a crianças com menos de 6 anos de idade.Antes de tomar Alipza, as raparigas adolescentes devem receber orientação eaconselhamento sobre contraceção.Outros medicamentos e AlipzaInforme o seu médico ou farmacêutico se estiver a tomar, tiver tomadorecentemente, ou se vier a tomar outros medicamentos, incluindo quaisquermedicamentos obtidos sem receita médica e medicamentos à base de plantas.Alguns medicamentos podem interferir com Alipza e não atuar devidamente.Informe o seu médico ou farmacêutico, especialmente se estiver a tomar qualquerum dos seguintes medicamentos:outros medicamentos chamados “fibratos”, tais como gemfibrozil e fenofibrato.eritromicina, ácido fusídico ou rifampicina - tipos de antibióticos utilizados parainfeções.varfarina ou qualquer outro medicamento utilizado para fluidificar o sangue.medicamentos para o VIH, denominados ""inibidores da protease"" (p. ex., ritonavir,lopinavir, darunavir, atazanavir) e ""inibidores não nucleosídeos da transcriptasereversa "" (p. ex., efavirenz).niacina (vitamina B3).se precisa de tomar ácido fusídico por via oral para tratar uma infeção bacterianaserá necessário interromper temporariamente a utilização deste medicamento. O seumédico irá dizer-lhe quando é seguro reiniciar o uso de Alipza. Tomar Alipza comácido fusídico pode raramente levar a fraqueza muscular, sensibilidade ou dor(rabdomiólise). Veja mais informações sobre rabdomiólise no ponto 4.Se qualquer um dos acima mencionados se aplicar a si (ou se não tiver a certeza),fale com o seu médico ou farmacêutico antes de tomar Alipza.Alipza com alimentos e bebidasAlipza pode ser tomado com ou sem alimentos.Gravidez, amamentação e fertilidadeNão tome Alipza se estiver grávida ou a amamentar. Se está a tentar engravidar falecom o seu médico antes de tomar Alipza.Se é uma mulher que pode ter filhos, deve utilizar um método contracetivo fiávelenquanto estiver a tomar Alipza. Pare de tomar Alipza e consulte imediatamente ummédico se engravidar enquanto estiver a tomar Alipza.Consulte o seu médico ou farmacêutico antes de tomar qualquer medicamento, seestiver grávida ou a amamentar.Condução de veículos e utilização de máquinasNão é de prever que Alipza interfira com a sua capacidade de conduzir ou utilizarmáquinas. Contudo, se sentir tonturas ou sonolência enquanto estiver a tomarAlipza, não conduza nem utilize máquinas ou ferramentas.Alipza contém lactose.Alipza contém lactose (um tipo de açúcar). Se foi informado pelo seu médico quetem intolerância ou não consegue digerir alguns açúcares, contacte-o antes de tomareste medicamento."
Quais são os efeitos secundários de Selexid?,"Como todos os medicamentos, este medicamento pode causar efeitos secundários, noentanto estes não se manifestem em todas as pessoas.Efeitos secundários importantes a que deve estar atento:Deve procurar ajuda médica de imediato se tiver algum dos seguintes sintomas: Se tiver dificuldade em respirar Se tiver inchaço no rosto ou garganta Se a sua pele desenvolver uma erupção ou inchaço Se tiver diarreia grave e permanente, com dores de estômago e febreOutros efeitos secundários possíveis:Frequentes (podem afetar mais de 1 em cada 100 pessoas) Infeção fúngica na vagina Diarreia Sentir-se enjoado (náuseas)Pouco frequentes (podem afetar 1-10 em cada 100 pessoas) Dor de cabeçaTonturas Vómitos Dor de estômago Úlceras na boca ou tubo digestivo, inflamação do tubo digestivo Distúrbios da função do fígado Alterações nos valores do sangue ou fígado Fraqueza muscular ou perda de músculo. Cansaço e falta de energia. Pouca quantidadede carnitina no corpo pode causar estes sintomas. Urticária Comichão FadigaComunicação de efeitos secundáriosSe tiver quaisquer efeitos secundários, incluindo possíveis efeitos secundários nãoindicados neste folheto, fale com o seu médico, farmacêutico ou enfermeiro. Tambémpoderá comunicar efeitos secundários diretamente ao INFARMED, I.P., através doscontactos abaixo.Direção de Gestão do Risco de MedicamentosParque da Saúde de Lisboa, Av. Brasil 531749-004 LisboaTel: +351 21 798 73 73Linha do Medicamento: 800222444 (gratuita)                 http://www.infarmed.pt/web/infarmed/submissaoramSítio da internet:E-mail: farmacovigilancia@infarmed.pt.Ao comunicar efeitos secundários, estará a ajudar a fornecer mais informações sobre asegurança deste medicamento."
Como devo tomar Neupro?,"Utilize este medicamento exatamente como indicado pelo seu médico ou farmacêutico. Fale com o seumédico ou farmacêutico se tiver dúvidas.Que dosagem de adesivo utilizarA dose de Neupro irá depender da sua doença – ver abaixo.• Neupro está disponível em diferentes dosagens de adesivos que libertam o medicamento ao longo de24 horas. As dosagens são 2 mg / 24 h, 4 mg / 24 h, 6 mg / 24 h e 8 mg / 24 h para o tratamento dadoença de Parkinson.• Pode ter que usar mais do que um adesivo para atingir a sua dose, conforme prescrito pelo seumédico.A embalagem de início de tratamento de Neupro contém 4 embalagens diferentes (uma para cadadosagem) com 7 adesivos em cada embalagem. Estas embalagens são normalmente necessárias paraas primeiras quatro semanas de terapêutica, mas dependendo da sua resposta ao Neupro, pode nãoprecisar de utilizar todas as embalagens de dosagens incluídas ou pode necessitar de embalagensadicionais para doses mais elevadas após a 4.ª semana, que não estão incluídas nesta embalagem.No primeiro dia de tratamento, comece com Neupro 2 mg (embalagem marcada com “Semana 1”) eutilize um adesivo transdérmico de Neupro 2 mg por dia. Utilize o Neupro 2 mg durante 7 dias (p. ex.se iniciar a um domingo, mude para a dose seguinte no domingo seguinte).No início da segunda semana utilize o Neupro 4 mg (embalagem marcada com ""Semana 2"").No início da terceira semana utilize o Neupro 6 mg (embalagem marcada com ""Semana 3"").No início da quarta semana utilize o Neupro 8 mg (embalagem marcada com ""Semana 4"").A dose adequada para si depende das suas necessidades.4 mg de Neupro diariamente pode ser uma dose eficaz para alguns doentes. Para a maioria dos doentescom doença de Parkinson em fase inicial, a dose adequada é alcançada em 3 ou 4 semanas, com dosesde 6 mg por dia ou 8 mg por dia, respetivamente. A dose máxima é de 8 mg por dia. Para a maioriados doentes com doença de Parkinson em fase avançada, a dose adequada é alcançada em 3 a7 semanas, com doses de 8 mg por dia até à dose máxima de 16 mg por dia. Para doses superiores a 8mg / 24 h (doses prescritas pelo seu médico acima das disponíveis), vários adesivos devem seraplicados para atingir a dose final. Por exemplo, a dose diária de 14 mg pode ser alcançada aplicandoum adesivo de 6 mg / 24 h e um adesivo de 8 mg / 24 h e da mesma maneira a dose diária de 16 mgpode ser alcançada aplicando dois adesivos de 8 mg / 24 h.Se tiver de parar de utilizar este medicamento, ver “Se parar de utilizar Neupro” na secção 3.Siga estas instruções ao utilizar Neupro:Neupro é um adesivo para aplicação na pele.     Assegure-se que remove o adesivo anterior antes de aplicar o novo.     Aplique o novo adesivo numa área da pele diferente cada dia.     Deixe o adesivo sobre a sua pele durante 24 horas e então retire-o e substitua-o por um novo.     Substitua o adesivo aproximadamente à mesma hora todos os dias.     Não corte o adesivo de Neupro em pedaços.Onde colar o adesivoColoque o lado adesivo sobre a pele limpa, seca esaudável das seguintes zonas como indicado a cinzentona figura ao lado:       Ombro ou antebraço       Barriga       Flanco (de lado, entre as costelas e a anca)       Coxa ou ancaPara ajudar a evitar a irritação da pele:     Aplique o adesivo numa zona da pele diferente todos os dias      (por exemplo, no lado direito do corpo num dia, depois no lado      esquerdo no dia seguinte. Ou parte superior do corpo num dia, e      depois na parte inferior do corpo).     Não deve aplicar Neupro na mesma zona da pele duas vezes em      14 dias.     Não aplique o adesivo sobre pele danificada ou com feridas ou    em pele vermelha ou irritada.Se, mesmo assim, tiver problemas na pele com o uso do adesivo, consulte a informação descrita naSecção 4 “Problemas na pele provocados pelo adesivo transdérmico” para mais informação.Evitar que o adesivo se descole ou caia     Não aplique o adesivo num local onde seja roçado por roupa apertada.     Não utilize cremes, óleos, loções, pós ou outros produtos para a pele sobre a zona da pele na      qual vai aplicar o adesivo ou perto de um adesivo que esteja a utilizar.     Se necessitar de aplicar o adesivo numa área da pele com pelos, deve rapar a área pelo menos      três dias antes de aplicar o adesivo transdérmico.      Se as bordas do adesivo levantarem, o adesivo pode ser colado com fita adesiva médica.Se o adesivo cair, deve ser aplicado um novo durante o resto do dia, substituindo-o à hora habitual.        Não permita que a área do adesivo aqueça - por exemplo luz solar excessiva, saunas, banhosquentes, almofadas de aquecimento ou botijas de água quente. Isso ocorre porque o medicamento podeser libertado mais rapidamente. Se achar que foi aplicado muito calor, entre em contacto com o seumédico ou farmacêutico.        Verifique sempre se o adesivo não caiu após tomar banho, duche ou fazer exercício.        No caso de o adesivo ter irritado a sua pele, mantenha a zona da pele resguardada da luzsolar direta. Isto porque pode provocar alterações na cor da pele.Como utilizar o adesivo transdérmico     Cada adesivo está embalado numa saqueta individual.     Antes de abrir a saqueta, decida onde você vai aplicar este novo adesivo e verifique se        removeu qualquer adesivo antigo.Aplique o adesivo de Neupro sobre a sua pele assim que tenha aberto a saqueta e removido orevestimento protetor descartável.1.Para abrir a saqueta segure-acom ambas as mãos.2.Separe a película.3. Abra a saqueta.4. Retire o adesivo dasaqueta.5.O lado adesivo do adesivoestá coberto por umrevestimento protetordescartável transparente.Segure o adesivo em ambasas mãos com o revestimentodescartável virado para si.6Dobre o adesivo ao meio.Isto faz com que a fenda emforma de S no revestimentoabra.7.● Descole um dos lados dorevestimento descartável. ● Não toque no ladoadesivo do adesivo com osdedos.8.● Segure a outra metade dorevestimento descartávelrígido.● Então aplique a metadeadesiva sobre a pele.● Pressione o lado adesivocom firmeza no lugar.9.Dobre a outra metade doadesivo para trás e remova ooutro lado do revestimentodescartável.10● Pressione o adesivo comfirmeza com a palma damão.● Mantenha a pressãodurante cerca de 30segundos.Isto garante que o adesivotoca na pele e que as bordascolam bem.11. Lave as suas mãos comsabão e água imediatamentea seguir a manusear oadesivo.Como remover o adesivo transdérmico usado   Descole lenta e cuidadosamente o adesivo utilizado.   Lave cuidadosamente a zona com água morna e sabão suave. Vai remover qualquer      viscosidade que permaneça na pele após a remoção do adesivo. Também pode utilizar uma      pequena quantidade de óleo para bebé para remover alguma viscosidade que não tenha saído      com a lavagem.   Não utilize álcool ou outros líquidos dissolventes tais como diluente de verniz das unhas ou      outros solventes, por estes poderem irritar a pele.Se utilizar mais Neupro do que deveriaUtilizar doses superiores de Neupro às prescritas pelo seu médico pode causar efeitos secundárioscomo sensação de má disposição (náuseas), vómitos, tensão arterial baixa, ver ou ouvir algo que não éreal (alucinações), sentir-se confuso, sonolência extrema, ter movimentos involuntários e convulsões.Nesses casos, entre em contato com seu médico ou hospital imediatamente. Indicar-lhe-ão o que fazer.Se utilizou um adesivo diferente (p. ex. Neupro 4 mg/24 h em vez de Neupro 2 mg/24 h) do que oindicado pelo seu médico, contacte imediatamente o seu médico ou o hospital para aconselhamento esiga as recomendações sobre a substituição dos adesivos.Contacte o seu médico caso tenha quaisquer reações desagradáveis.Caso se tenha esquecido de substituir o adesivo à hora habitual    Caso se tenha esquecido de substituir o adesivo à sua hora habitual, substitua-o logo que se       lembre. Remova o adesivo o velho, utilize um novo adesivo.    Caso se tenha esquecido de aplicar um novo adesivo após ter removido o velho, utilize um       novo adesivo Caso se tenha esquecido de aplicar um novo adesivo após ter removido o velho,       utilize um novo adesivo logo que se lembre.Nas duas situações, no dia a seguir deve utilizar um adesivo novo na hora habitual. Não utilize umadose a dobrar para compensar uma dose que se esqueceu de utilizar.Se parar de utilizar NeuproNão pare de utilizar Neupro subitamente sem falar com o seu médico. Uma interrupção súbita podelevá-lo a desenvolver uma doença chamada síndrome neuroléptica maligna, que pode apresentar riscode vida. Os sinais incluem: perda do movimento dos músculos (acinesia), rigidez muscular, febre,tensão arterial instável, aumento da frequência cardíaca (taquicardia), confusão, baixo nível deconsciência (tal como coma).Se o seu médico indicar que deve parar de utilizar Neupro, a sua dose diária de Neupro deve serreduzida gradualmente Doença de Parkinson - diminuída em 2 mg, dia sim, dia não.Caso ainda tenha dúvidas sobre a utilização deste medicamento, fale com o seu médico, farmacêuticoou enfermeiro."
Quais são os componentes presentes na composição de Serevent?,"Qual a composição de Serevent A substância ativa é o xinafoato de salmeterol. Cada atuação (dose) contém 25 microgramas de salmeterol(sob a forma de xinafoato), equivalente a 21 microgramas de salmeterol libertados do actuador (doselibertada). O outro componente é norflurano (HFA 134 a).Qual o aspeto de Serevent e conteúdo da embalagemSerevent é uma suspensão pressurizada para inalação. O recipiente metálico pressurizado contém umasuspensão branca a esbranquiçada para inalação.A suspensão é acondicionada em recipiente pressurizado de 8 ml de liga de alumínio, laqueadointernamente e selado com válvula doseadora. O recipiente é incorporado num actuador de plástico comaplicador bucal atomizador e tampa protetora de poeiras. Cada embalagem contém 120 doses.Cada atuação contém 25 microgramas da substância ativa salmeterol."
Quais são os efeitos colaterais ao tomar Ursofalk?,"Como todos os medicamentos, este medicamento pode causar efeitos secundários, emboraestes não se manifestem em todas as pessoas.Efeitos secundários frequentes (que ocorrem em menos de 1 em 10 mas mais de 1 em 100doentes tratados): fezes soltas e moles ou diarreia.Efeitos secundários muito raros (que ocorrem em menos de 1 em 10.000 doentestratados): durante o tratamento da cirrose biliar primária: dor grave na área superior direita doabdómen, agravamento acentuado (descompensação) da cirrose hepática que regrideparcialmente após a suspensão do tratamento. calcificação dos cálculos biliares. urticária.Comunicação de efeitos secundáriosSe tiver quaisquer efeitos secundários, incluindo possíveis efeitos secundários nãoindicados neste folheto, fale com o seu médico, farmacêutico ou enfermeiro. Tambémpoderá comunicar efeitos secundários através do sistema nacional de notificaçãomencionado abaixo:INFARMED, I.P.Direção de Gestão do Risco de MedicamentosParque da Saúde de Lisboa, Av. Brasil 531749-004 LisboaTel: +351 21 798 71 40Fax: + 351 21 798 73 97Sítio da internet:http://extranet.infarmed.pt/page.seram.frontoffice.seramhomepageE-mail: farmacovigilancia@infarmed.ptAo comunicar efeitos secundários, estará a ajudar a fornecer mais informações sobre asegurança deste medicamento."
Em que situações o remédio de Campral é contraindicado?,"Não tome Campral se tem alergia ao acamprosato de cálcio ou a qualquer outro componente destemedicamento (indicados na secção 6); se está a amamentar; se sofre de problemas renais graves.Só os adultos devem tomar Campral. Este medicamento não é aconselhado a crianças eidosos.Advertências e precauçõesFale com o seu médico, farmacêutico ou enfermeiro antes de tomar Campral.Se sofre de problemas hepáticos graves.Campral não é usado para o tratamento dos sintomas agudos da fase de retirada doálcool.Na ausência de dados clínicos disponíveis, Campral não deve ser recomendado a doentescom idade inferior a 18 anos e superior a 65 anos.Devido à reconhecida e complexa inter-relação entre a dependência do álcool, depressão eideação suicida, recomenda-se que os doentes dependentes do álcool, incluindo os queestão a ser tratados com acamprosato, sejam acompanhados de perto quanto aosrespetivos sintomas.Outros medicamentos e CampralInforme o seu médico ou farmacêutico se estiver a tomar, ou tiver tomado recentemente,ou se vier a tomar outros medicamentos.Campral pode ser administrado em associação com outros medicamentos usados notratamento da síndrome de abstinência.Pelos dados disponíveis, Campral evidenciou não interferir com outros fármacos tambémusados no tratamento do alcoolismo, tanto na fase de desintoxicação como na demanutenção da abstinência.Não se verificaram alterações na frequência das reações adversas quando Campral éusado concomitantemente com dissulfiram, oxazepam, tetrabamato ou meprobamato.Nos ensaios clínicos, o acamprosato tem sido administrado com segurança emcombinação com antidepressivos, ansiolíticos, hipnóticos e sedativos, e analgésicos nãoopioides.Campral com alimentos, bebidas e álcoolOs comprimidos devem ser tomados de preferência entre as refeições se a tolerânciagastrointestinal for boa.A toma concomitante de álcool e Campral não afeta a farmacocinética do álcool ou doacamprosato.A ingestão de álcool durante o tratamento com Campral não o fará sentir doente mas éfortemente desaconselhada. Mesmo só com a ingestão de uma pequena quantidade deálcool, corre o risco de anular o tratamento e ter tendência para voltar a bebernovamente.Gravidez, amamentação e fertilidadeSe está grávida ou a amamentar, se pensa estar grávida ou planeia engravidar, consulte oseu médico ou farmacêutico antes de tomar este medicamento.Campral só deverá ser usado durante a gravidez após avaliação cuidadosa da relaçãobenefício/risco pelo médico.Campral não deverá ser administrado a mulheres a amamentar.Condução de veículos e utilização de máquinasCampral não provoca sonolência, não tendo pois qualquer interferência sobre acapacidade de condução e de utilização de máquinas.Campral contém sódioEste medicamento contém menos de 1 mmol (23 mg) de sódio por comprimido, ou seja épraticamente ""isento de sódio""."
Do que Neotigason é composto?,"Qual a composição de NeotigasonNeotigason 10 mg CápsulasA substância ativa é a acitretina. Cada cápsula contém 10 mg de acitretina.Os outros componentes são:Conteúdo da cápsula: celulose microcristalina, maltodextrina, ascorbato de sódio.Cápsula:Cabeça: gelatina, óxido de ferro negro (E172), óxido de ferro amarelo (E172), óxidode ferro vermelho (E172), dióxido de titânio (E171);Corpo: gelatina, dióxido de titânio (E171)Tinta de impressão: Shellac, álcool isopropílico, butanol, propilenoglicol (E1520),hidróxido de amónio, óxido de ferro negro (E172).Neotigason 25 mg CápsulasA substância ativa é a acitretina. Cada cápsula contém 25 mg de acitretina.Os outros componentes são:Conteúdo da cápsula: celulose microcristalina, maltodextrina, ascorbato de sódio,gelatina.Cápsula:Cabeça: gelatina, óxido de ferro negro (E172), óxido de ferro amarelo (E172), óxidode ferro vermelho (E172), dióxido de titânio (E171);Corpo: gelatina, dióxido de titânio (E171) óxido de ferro amarelo (E172)Tinta de impressão: Shellac, álcool isopropílico, butanol, propilenoglicol (E1520),hidróxido de amónio, óxido de ferro negro (E172).Qual o aspeto de Neotigason e conteúdo da embalagemNeotigason 10 mg CápsulasCápsulas com cabeça castanha e corpo branco com “10” impresso a preto no corpo,cápsula de dimensão 4.Neotigason 25 mg CápsulasCápsulas com cabeça castanha e corpo amarelo com “25” impresso a preto no corpo,cápsula de dimensão 1.Embalagens com 20 ou 50 cápsulas em blisters de PVC/PVDC/Alu.É possível que não sejam comercializadas todas as apresentações."
