Question,Original Info
Caso eu tenha histórico de doenças cardíacas posso tomar Norterol?,"Não tome Norterol se tem alergia (hipersensibilidade) à nortriptilina (substância activa) ou a qualqueroutro componente de Norterol; se está em fase de recuperação de um enfarte do miocárdio; se sofre de defeitos na condução cardíaca; se manifesta intoxicação opiácea, barbitúrica e alcoólica aguda; se está a tomar ou tomou há menos de 2 semanas medicamentos do tipo inibidores damonoaminoxidase (IMAO) - (Ver ""Ao tomar Norterol com outros medicamentos”).Tome especial cuidado com Norterol Utilização em crianças e adolescentes com idade inferior a 18 anos:Nortriptilina não deve ser administrada para o tratamento da depressão em crianças eadolescentes com idade inferior a 18 anos. Não foi demonstrada eficácia dosantidepressivos tricíclicos em estudos com doentes deste grupo etário com depressão. No caso de ser diabético, doente do foro cardíaco, sofrer de hipertiroidismo (alteraçãoda tiróide), ter tido alguma crise epiléptica, ou sofrer de tensão ocular aumentada, deveinformar o seu médico para que sejam tomadas as devidas precauções. Devem ser cuidadosamente vigiados, os doentes com tendência ou tentativa anteriorde suicídio, e os doentes com antecedentes de retenção urinária. Se se encontra deprimido e/ou tem distúrbios de ansiedade poderá por vezes pensarem se auto-agredir ou até suicidar. Estes pensamentos podem aumentar no início dotratamento com antidepressivos, pois estes medicamentos necessitam de tempo paraactuarem. Normalmente os efeitos terapêuticos demoram cerca de duas semanas afazerem-se sentir mas por vezes pode demorar mais tempo.Poderá estar mais predisposto a ter este tipo de pensamentos nas seguintes situações: Se tem antecedentes de ter pensamentos acerca de se suicidar ou se auto-agredir. Se é um jovem adulto. A informação proveniente de estudos clínicos revelou um riscode comportamento suicídio em indivíduos adultos com menos de 25 anos comproblemas psiquiátricos tratados com antidepressivos.Se em qualquer momento vier a ter pensamentos no sentido de auto-agressão ousuicídio deverá contactar o seu médico ou dirigir-se imediatamente ao hospital.Poderá ser útil para si comunicar a uma pessoa próxima de si ou a um familiar que seencontra deprimido ou que tem distúrbios de ansiedade e dar-lhes este folheto a ler.Poderá também solicitar-lhes que o informem caso verifiquem um agravamento do seuestado de depressão ou ansiedade, ou se ficarem preocupados com alterações do seucomportamento. Os estudos com outros grupos de antidepressivos, nomeadamente os InibidoresSelectivos da Recaptação da Serotonina, demonstraram que estes medicamentosestavam relacionados com ideação suicida, auto-agressividade e hostilidadade. O riscode ocorrência destas reacções não pode ser excluído para a Nortriptilina. Adicionalmente, Nortriptilina está associada ao risco de eventos adversoscardiovasculares em todos os grupos etários. Para além do exposto, não existem ainda disponíveis dados de segurança de utilizaçãoa longo prazo em crianças e adolescentes no que concerne ao crescimento, maturação edesenvolvimento cognitivo e comportamental.Ao tomar Norterol com outros medicamentosInforme o seu médico ou farmacêutico se estiver a tomar ou tiver tomado recentementeoutros medicamentos, incluindo medicamentos obtidos sem receita médica.Certos medicamentos podem causar interacção com o Norterol, aumentando oudiminuindo o seu efeito terapêutico. É o caso de: inibidores de monoaminoxidase (ver ""Não tome Norterol”), anti-hipertensores (ex: betanidina, clonidina), alguns medicamentos do tipo hipnótico (barbitúricos), medicamentos antiepilépticos o outros medicamentos que actuam a nível do sistemanervoso central, medicamentos contendo levodopa ou cimetidina, anestésicos gerais e locais.O Norterol pode também potenciar o efeito sedativo do álcool.Gravidez e aleitamentoSe estiver grávida, se pretender engravidar ou se estiver a amamentar, consulte o seumédico ou farmacêutico antes de tomar qualquer medicamento.O Norterol não deve ser administrado durante a gravidez a não ser por expressaindicação do médico.Salvo indicação médica em contrário, se engravidar durante o tratamento com Norterol,deve reduzir gradualmente a dosagem até suspender o tratamento. Em qualquer doscasos, o medicamento deve ser totalmente suspenso até 14 dias antes do dia calculadopara o parto.Apesar da nortriptilina se encontrar no leite materno em baixas concentrações, éprovável que não venha a afectar a criança quando se empregam doses terapêuticas. Noentanto recomenda-se a observação da criança principalmente nas quatro primeirassemanas de vida.Portanto, se está grávida ou pretender engravidar, ou se estiver a amamentar, deveinformar o seu médico.Utilização em doentes com patologias especiaisA administração do Norterol em doentes cardiovasculares, doentes com hipertiroidismo(alteração da tiróide), doentes com história de retenção urinária, doentes epilépticos,requer uma rigorosa vigilância por parte do seu médico.Se sofrer de alguma destas patologias lembre-se de informar o seu médico porque podeser necessário ajustar-se a dose.Condução de veículos e utilização de máquinasOs doentes tratados com Norterol devem ter precaução ao conduzir veículos e aoutilizar máquinas, pelo facto de este medicamento lhes poder diminuir a capacidade dereacção.Informações importantes sobre alguns componentes de Norterol Norterol contém lactose. Se foi informado pelo seu médico que tem intolerância aalguns açúcares, contacte-o antes de tomar este medicamento."
Para que serve Octiset?,"A aplicação continuada de Octiset elimina os germes tais como bactérias e fungospor um período limitado de tempo e atua como tratamento de preparação damembrana mucosa e pele circundante antes de uma cirurgia na região genital eórgãos de excreção, incluindo a inserção de um cateter, assim como para utilizaçãocontinuada, eliminação limitada de germes tais como bactérias e fungos em feridas epromoção da cicatrização de feridas.Octiset está também indicado como antisséptico na cavidade oral, assim como naterapêutica de suporte em micoses interdigitais e tratamento antisséptico adjuvantede feridas.Se não se sentir melhor ou se piorar após 14 dias, tem de consultar um médico."
Quais são os efeitos colaterais de Griponal?,"Como todos os medicamentos, este medicamento pode causar efeitos indesejáveis,embora estes não se manifestem em todas as pessoas.Como a maioria dos efeitos indesejáveis decorrem da comunicação espontânea durante acomercialização, não é possível fazer um cálculo preciso da frequência.Os efeitos indesejáveis seguintes foram sentidos por alguns dos doentes que tomaramGriponal comprimidos efervescentes:Em casos de doses muito elevadas, de cerca de 10 a 15 g em adultos, podem surgirefeitos hepáticos graves (hepatotoxicidade que leva a necrose hepática);Em pessoas sensíveis, pode verificar-se sonolência, embora de intensidade ligeira;Ocasionalmente, pode verificar-se secura da boca, visão turva, prisão de ventre edificuldade em urinar, assim como dores de cabeça, excitabilidade, fadiga, nervosismo etonturas;Podem ocorrer reações que incluem perturbações gastrointestinais como náuseas evómitos;Foram comunicados casos muito raros de reações cutâneas graves;Em casos raros, podem surgir alterações sanguíneas.Se algum dos efeitos indesejáveis se agravar ou se detetar quaisquer efeitos indesejáveisnão mencionados neste folheto, informe o seu médico ou farmacêutico.Comunicação de efeitos indesejáveisSe tiver quaisquer efeitos indesejáveis, incluindo possíveis efeitos indesejáveis nãoindicados neste folheto, fale com o seu médico ou farmacêutico. Também poderácomunicar efeitos indesejáveis diretamente ao INFARMED, I.P. através dos contactosabaixo. Ao comunicar efeitos indesejáveis, estará a ajudar a fornecer mais informaçõessobre a segurança deste medicamento.Sítio da internet: http://www.infarmed.pt/web/infarmed/submissaoram(preferencialmente) ou através dos seguintes contactos:Direção de Gestão do Risco de MedicamentosParque da Saúde de Lisboa, Av. Brasil 531749-004 LisboaTel: +351 21 798 73 73Linha do Medicamento: 800222444 (gratuita)E-mail: farmacovigilancia@infarmed.pt"
Quais são os possíveis efeitos secundários ao tomar Otoceril?,"Como os demais medicamentos, Otoceril pode causar efeitos secundários em algumas pessoas.Otoceril é geralmente bem tolerado. Contudo podem ocorrer muito raramente irritação localdevido ao diclorobenzeno ou reacções de sensibilização devido à benzocaína.Se algum dos efeitos secundários se agravar ou se detectar quaisquer efeitos secundários nãomencionados neste folheto, informe o seu médico ou farmacêutico."
O que pode acontecer se eu exceder a dose de Cyteal,"Não utilize Cyteal: Se tem alergia à cloro-hexidina, hexamidina, clorocresol ou a qualquer outrocomponente deste medicamento (indicados na secção 6). Em caso contato com os olhos e ouvidos. Em caso de contato acidental da soluçãocom os olhos, lavar imediata e abundantemente com água. No canal auditivo externo se tem o tímpano perfurado, e em geral, no tecidonervoso ou meninges. Para desinfetar acessórios médicos e cirúrgicos. Para desinfeção de pele saudável (exemplo: antes de recolha de amostras oucirurgias).Advertências e precauçõesFale com o seu médico ou farmacêutico antes de utilizar Cyteal. Após a utilização deste produto, lave cuidadosamente com água abundante. Não utilize este medicamento, sem a opinião do médico, numa grande superfície depele, sob um penso oclusivo, em pele irritada (especialmente em pele queimada),membranas mucosas, na pele de bebés prematuros ou recém-nascidos devido aorisco de passagem para a circulação sanguínea. Foi notificada erupção cutânea local (incluindo alergia) devido à hexamidina e adois excipientes presentes no líquido cutâneo. No caso de sintomas graves, deveinterromper o tratamento e consultar o seu médico ou farmacêutico antes de utilizarCyteal novamente. Usar com precaução em bebés recém-nascidos, especialmente em prematuros.Cyteal pode causar queimaduras químicas na pele. Não use quantidades excessivas enão permita que a solução se acumule nas pregas da pele ou sobre o bebé ou deitenas fraldas ou outro material em contato direto com o paciente.Outros medicamentos e CytealInforme o seu médico ou farmacêutico se estiver a utilizar, ou tiver utilizadorecentemente, ou se vier a utilizar outros medicamentos.A associação de outro agente antisséptico deverá ser evitada, pois os seus efeitospodem ser cancelados. Não utilizar em simultâneo com sabão comum e não fechar ofrasco com uma rolha de cortiça.Gravidez e amamentaçãoSe está grávida ou a amamentar, se pensa estar grávida ou planeia engravidar,consulte o seu médico ou farmacêutico antes de tomar este medicamento.Como medida preventiva, é preferível evitar a utilização de Cyteal durante a gravideze a amamentação.Condução de veículos e utilização de máquinasNão foram realizados estudos sobre os efeitos de Cyteal sobre a capacidade deconduzir e utilizar máquinas.Este medicamento contém clorocresol. Pode causar reações alérgicas."
Como posso tomar o remédio de Modulanzime?,"Tomar Modulanzime sempre de acordo com o seu médico. Fale com o seu médico oufarmacêutico se tiver dúvidas. A dose habitual varia consoante critério clínico.Em média: 2 cápsulas antes das refeições.Cápsulas para administração oral; deglutir a cápsula inteira com um pouco de água.A duração média do tratamento varia de acordo com a indicação médica.IdososModulanzime pode utilizar-se sem precauções especiais em grupos etários avançadosou casos com outras lesões associadas visto, nas doses correntes, não alterar osparâmetros circulatórios e respiratórios, bioquímica ou metabolismo.Se tomar mais Modulanzime do que deveriaA terapêutica deverá ser sintomática.Caso se tenha esquecido de tomar ModulanzimeNão tome uma dose a dobrar para compensar uma dose que se esqueceu de tomar.Caso ainda tenha dúvidas sobre a utilização deste medicamento, fale com o seu médicoou farmacêutico."
Qual é a contraindicação ao tomar Maxilase?,"Não tome Maxilase Se tem alergia (hipersensibilidade) à substância activa, alfa-amilase, ou a qualquer outrocomponente de Maxilase.Tome especial cuidado com Maxilase Se é um doente com problemas hereditários raros de intolerância à frutose, malabsorçãoglucose-galactose ou insuficiência sucrase-isomaltase não devem tomar este medicamento. Quando da persistência ou aparecimento de novos sintomas (dores de garganta graves, dores decabeça, náuseas, vómitos) ou em caso de febre associada, deve reavaliar-se a estratégiaterapêutica.Este medicamento não deve ser utilizado durante longos períodos de tempo sem conselho médico.Tomar Maxilase com outros medicamentosNão há conhecimento de relatos de interacções entre a alfa amilase e outros produtos medicinais.Informe o seu médico ou farmacêutico se estiver a tomar ou tiver tomado recentemente outrosmedicamentos, incluindo medicamentos obtidos sem receita médica.Tomar Maxilase com alimentos ou bebidasAconselha-se a toma de Maxilase antes das refeições.Gravidez e aleitamentoNo que respeita a alfa amilase não existem dados clínicos sobre as gravidezes a ele expostas.Estudos em animais não revelaram efeitos prejudiciais directos ou indirectos sobre a gravidez, odesenvolvimento embrio-fetal e o parto. Este medicamento só deve ser receitado a mulheresgrávidas com muita precaução.Aleitamento:Não se sabe se o alfa amilase passa para o leite materno humano. Deve evitar-se a administraçãodeste medicamento durante o aleitamento.Consulte o seu médico ou farmacêutico antes de tomar qualquer medicamentoCondução de veículos e utilização de máquinasNão aplicável.Informações importantes sobre alguns componentes de MaxilaseDeve ter atenção aos componentes deste medicamento, como a sacarose (186,86 mg/comprimido)e a lactoglobulina - lactose (149,3 mg/comprimido) e aos seus efeitos nos doentes diabéticos, jádescritos anteriormente.Se foi informado pelo seu médico que tem intolerância a alguns açúcares contacte-o antes detomar este medicamento.Este medicamento contém amarelo sunset (E110) o qual pode causar reacções alérgicas."
Para que serve Aldactazine?,"Aldactazine pertence a um grupo de medicamentos designados por diuréticospoupadores de potássio, medicamentos que aumentam a produção de urina.Aldactazine está indicado em situações de pressão arterial elevada (hipertensão), emsituações de retenção de água (edema) e ascite (acumulação de líquido na cavidadeabdominal), devido a insuficiência cardíaca, cirrose do fígado ou mau funcionamentodos rins (síndroma nefrótica).Aldactazine também está indicado em doentes em tratamento com digitálicos(medicamentos utilizados para tratar algumas doenças de coração, como arritmiasou insuficiência cardíaca), quando outros medicamentos antidiuréticos não foramsuficientes na manutenção do equilíbrio eletrolítico."
Quais são os efeitos negativos ao tomar Largactil?,"Como todos os medicamentos, este medicamento pode causar efeitos secundários,embora estes não se manifestem em todas as pessoas.A partir de doses reduzidasPerturbações neuro-vegetativas: hipotensão ortostática efeitos anticolinérgicos do tipo boca seca, alterações da acomodação, risco de retençãourinária obstipação e possível iléus adinâmicoPerturbações neuro-psíquicas: sedação e/ou sonolência, mais marcada no início do tratamento indiferença, reações ansiosas, variações do estado de humorCom doses mais elevadasPerturbações neurológicas: discinesias precoces (cervico-faciais e oculares) síndrome extrapiramidal (acatísia, parkinsonismo) cedendo parcialmente aosantiparkinsónicos anticolinérgicos discinesias tardias, sobretudo em caso de tratamentos prolongados, não cedendo aosantiparkinsónicos anticolinérgicos convulsõesPerturbações endócrinas e metabólicas: - hiperprolactinémia podendo conduzir a amenorreia, galactorreia, ginecomastia,impotência e frigidez alteração da regulação da temperatura corporal aumento de peso intolerância à glucose, hiperglicemia (ver “Advertências e precauções"") hipertrigliceridemiahiponatremia secreção inapropriada da hormona antidiuréticaRaramente e dose-dependentesAlterações cardíacas: alongamento do intervalo QT arritmias incluindo raros casos de tipo torsade de pointes foram relatados casos isolados de morte súbita de possível origem cardíacaMais raramente e não dose-dependentesAlterações cutâneas e do sistema imunitário: reações cutâneas do tipo alérgico (eritema, urticária, angioedema) reações anafiláticas muito raras reações de fotossensibilidade o lúpus eritematoso sistémico foi raramente associado ao tratamento comcloropromazina estando ainda descritos casos de presença de anticorpos antinuclearessem manifestação clínica da doençaAlterações hematológicas: leucopenia agranulocitose eosinofilia anemia hemolítica, anemia aplásica púrpura trombocitopénico pancitopeniaAlterações oculares: depósitos pigmentares no segmento anterior do olho habitualmente sem consequênciaspara a visãoAlterações hepáticas: icterícia do tipo colestático, mais frequente nas primeiras 4 semanas de tratamento ede mecanismo provavelmente alérgico lesões hepáticas do tipo colestático, citolítico ou misto que podem ser gravesDoenças gastrointestinais: colite isquémica obstrução intestinal necrose gastrointestinal colite necrosante (por vezes fatal) perfuração intestinal (por vezes fatal)Diversos: edema náuseas casos inexplicados de morte súbita em doentes que recebiam neurolépticosfenotiazínicos foram descritos casos muito raros de priapismo em doentes tratados comcloropromazina síndrome maligna dos neurolépticos: interromper imediatamente o tratamento em casode hipertermia sem causa aparente (ver "" Advertências e precauções "") coágulos nas veias, especialmente nas pernas (sintomas incluem inchaço, dor evermelhidão na perna), que se podem deslocar pelos vasos sanguíneos até aos pulmões ecausar dor no peito e dificuldade em respirar. Se detetar algum destes sintomas, procureaconselhamento médico de imediato. em idosos com demência, foi notado um pequeno aumento no número de mortesnotificadas para doentes a tomar antipsicóticos, quando comparado com os que nãofaziam este tipo de tratamento.Comunicação de efeitos secundáriosSe tiver quaisquer, incluindo possíveis efeitos secundários não indicados neste folheto,fale com o seu médico ou farmacêutico. Também poderá comunicar efeitos secundáriosdiretamente ao INFARMED, I.P. através dos contactos abaixo. Ao comunicar efeitossecundários, estará a ajudar a fornecer mais informações sobre a segurança destemedicamento.INFARMED, I.P.Direção de Gestão do Risco de MedicamentosParque da Saúde de Lisboa, Av. Brasil 531749-004 LisboaTel: +351 21 798 71 40Fax: +351 21 798 73 97Sítio da internet: http://extranet.infarmed.pt/page.seram.frontoffice.seramhomepageE-mail: farmacovigilancia@infarmed.pt"
Quando não devo tomar Victan?,"Não tome Victan: se tem alergia (hipersensibilidade) às benzodiazepinas ou a qualquer outro componente destemedicamento (indicados na secção 6). se sofrer de insuficiência respiratória grave ou doença hepática grave se sofrer de apneia do sono se sofrer de miastenia gravisO Victan é contra-indicado em crianças.Se alguma das situações acima mencionadas se aplica a si, informe o seu médico e aconselhe-secom ele.Advertências e precauçõesHá certas doenças que podem levar a adoptar cuidados especiais antes de tomar o Victan oudurante o tratamento com Victan. Por esse motivo, deve informar o seu médico das doenças deque sofre actualmente ou de que sofreu no passado. Deve, em especial, informar o seu médicose sofre de doenças do rim ou do fígado, doenças respiratórias, ou doenças musculares(miastenia).Informe também o seu médico se teve previamente qualquer reacção medicamentosa.O tratamento com qualquer benzodiazepina pode provocar dependência física ou psicológica.Este efeito é influenciado pela duração do tratamento, pela dose utilizada, pela combinação comoutros ansiolíticos ou hipnóticos, pelo álcool e pela história de dependências. A referidadependência pode originar sintomas de abstinência quando se pára ou interrompe bruscamente otratamento (insónias, dores de cabeça, dores musculares, ansiedade, irritabilidade, agitação).Portanto, em caso de tratamento prolongado ou com doses elevadas, o tratamento, na maioriadas situações de ansiedade reaccional, não deve ultrapassar as 4 a 12 semanas, e as doses usadasdevem ser progressivamente reduzidas (durante alguns dias ou algumas semanas). A duração dotratamento pode ser prolongada, de acordo com o critério do seu médico.Pode surgir amnésia, em especial se o Victan for usado à hora de deitar e se a duração dosono for insuficiente (por exemplo se for obrigado a acordar muito cedo por qualquer motivo)Suicídio:Alguns estudos demonstraram um risco aumentado de ideação suicida, tentativa de suicídio esuicídio em doentes a tomar certos sedativos e hipnóticos, incluindo este medicamento. Noentanto, não foi estabelecido se tal é causado pelo medicamento ou se podem existir outrosmotivos. Se tem pensamentos suicidas, fale com o seu médico o mais breve possível paraaconselhamento médico adicional (ver secção 4).A duração do tratamento deve ser tão curta quanto possível.Não interrompa o tratamento de um dia para o outro.Outros medicamentos e VictanO Victan pode alterar a reação do seu organismo a alguns medicamentos. Por esse motivo devesempre informar o seu médico se está também a tomar outros medicamentos, incluindo aquelesque se adquirem sem receita médica.Em especial, informe o seu médico se estiver a tomar algum dos seguintes medicamentos:depressores do sistema nervoso central (benzodiazepinas, analgésicos, antitússicos, barbitúricos,antihistamínicos, antidepressivos, neurolépticos), cisapride, clozapina, depressoresneuromusculares.O seu médico decidirá se esses medicamentos devem ou não ser descontinuados, ou se a suamanutenção exige vigilância apertada ou modificação da posologia.Victan com alimentos e bebidas, bebidas e álcoolNão deve tomar bebidas alcoólicas durante o tratamento.Condução de veículos e utilização de máquinasPode surgir ocasionalmente sonolência ou diminuição dos reflexos durante o tratamento comVictan, como acontece com qualquer benzodiazepina. Se sentir sonolência consulte o seumédico antes de tentar conduzir veículos ou operar máquinas.Gravidez, amamentação e fertilidadeGravidezA utilização deste medicamento não está recomendada durante a gravidez.Se descobrir que está grávida ou se planeia engravidar, consulte o seu médico o mais depressapossível para reavaliar a necessidade de tratamento.Não foi demonstrada evidência de malformações associadas ao uso debenzodiazepinas, numa grande quantidade de dados. Contudo, alguns estudos mostraram umrisco potencialmente aumentado defenda labial e palatina em recém-nascidos em comparaçãocom a população em geral. O uso deste medicamento não é recomendado durante a gravidez.A fenda labial e palatina (às vezes chamada de ""lábio leporino"") é uma deformação aonascimento causada por fusão incompleta do palato e lábio superior.Pode ocorrer redução do movimento fetal e alterações na frequência cardíaca depois da tomade loflazepato de etilo durante o segundo e/ou terceiro trimestre da gravidez.Se Victan for tomado na fase final da gravidez, o seu bebé pode apresentar fraqueza muscular(hipotonia ou síndrome da criança hipotónica), descida da temperatura corporal (hipotermia),dificuldades de alimentação (problemas na amamentação conduzindo a um baixo aumento depeso) e problemas respiratórios (sofrimento respiratório).Se for tomado com regularidade na fase final da gravidez, o seu bebé pode desenvolversintomas de abstinência, como agitação ou tremores. Neste caso, o recém-nascido deverá servigiado durante o período pós-natal.AmamentaçãoO Victan não é recomendado durante a amamentação.Em caso de dúvida consulte sempre o seu médico ou farmacêutico"
