Question,Similarity Search
Para que serve Octiset?,"de efeitos secundários.Se Octiset for utilizado em contacto com preparações tradicionais de lavagem elimpeza, a substância ativa dicloridrato de octenidina pode tornar-se ineficaz.Aplicar com cuidado em recém-nascidos, principalmente nos prematuros. Octisetpode causar graves lesões cutâneas. Remover o excesso de produto e garantir que asolução não permanece em contacto com a pele durante mais tempo do que énecessário (incluindo materiais com gotas de solução em contacto direto com odoente).Deve evitar-se a aplicação de Octiset nos olhos. Em caso de contacto com os olhos,lavar imediatamente com muita água.Crianças e adolescentesEstudos com Octiset realizados em lactentes e crianças com idade inferior a 12 anosconfirmaram a sua elevada eficácia, tolerabilidade e segurança. Em virtude dosdados fornecidos relativamente a crianças e adultos, o Octiset pode também serrecomendado para utilização em adolescentes.Outros medicamentos e OctisetInforme o seu médico ou farmacêutico se estiver a"
Quais são os efeitos colaterais de Griponal?,"pode levar a colapso com perigode vida). Os indivíduos que manipulem rotineiramente as formulações em pó estãomais predispostos a desenvolver estas reações (ver secção 2).Se tiver quaisquer efeitos secundários, incluindo possíveis efeitos secundários nãoindicados neste folheto, fale com o seu médico ou farmacêutico."
Quais são os possíveis efeitos secundários ao tomar Otoceril?,"podem ser mais propensos a alguns dos efeitos mencionadosacima.Se tiver quaisquer efeitos secundários, incluindo possíveis efeitos secundários nãoindicados neste folheto, fale com o seu médico, farmacêutico ou enfermeiro."
O que pode acontecer se eu exceder a dose de Cyteal,"Não utilize Cyteal: Se tem alergia à cloro-hexidina, hexamidina, clorocresol ou a qualquer outrocomponente deste medicamento (indicados na secção 6). Em caso contato com os olhos e ouvidos. Em caso de contato acidental da soluçãocom os olhos, lavar imediata e abundantemente com água. No canal auditivo externo se tem o tímpano perfurado, e em geral, no tecidonervoso ou meninges. Para desinfetar acessórios médicos e cirúrgicos. Para desinfeção de pele saudável (exemplo: antes de recolha de amostras oucirurgias).Advertências e precauçõesFale com o seu médico ou farmacêutico antes de utilizar Cyteal. Após a utilização deste produto, lave cuidadosamente com água abundante. Não utilize este medicamento, sem a opinião do médico, numa grande superfície depele, sob um penso oclusivo, em pele irritada (especialmente em pele queimada),membranas mucosas, na pele de bebés prematuros ou recém-nascidos devido aorisco de passagem para a circulação sanguínea. Foi notificada erupção"
Como posso tomar o remédio de Modulanzime?,"Não tome Modulanzime se tem alergia (hipersensibilidade) a bromoprida, simeticone, pepsina A, amilase elipase ou a qualquer outro componente de Modulanzime. se a estimulação da motricidade gastro-intestinal apresentar perigo. se ocorrer hemorragia gastro-intestinal, obstrução mecânica ou perfuração digestiva. se tiver doença de Parkinson.Tome especial cuidado com ModulanzimeNão aplicável.Ao tomar Modulanzime com outros medicamentosInforme o seu médico ou farmacêutico se estiver a tomar ou tiver tomado recentementeoutros medicamentos, incluindo medicamentos obtidos sem receita médica.Modulanzime não apresenta incompatibilidade alimentar ou medicamentosa conhecida,exceto a associação a atropínicos que anulam o efeito sobre a motilidade digestiva.Gravidez e aleitamentoConsulte o seu médico ou farmacêutico antes de tomar qualquer medicamento.Como para todos os medicamentos, Modulanzime só deve ser administrado a grávidasquando estritamente necessário.Condução de veículos"
Qual é a contraindicação ao tomar Maxilase?,"Não tome Maxilase Se tem alergia (hipersensibilidade) à substância activa, alfa-amilase, ou a qualquer outrocomponente de Maxilase.Tome especial cuidado com Maxilase Se é um doente com problemas hereditários raros de intolerância à frutose, malabsorçãoglucose-galactose ou insuficiência sucrase-isomaltase não devem tomar este medicamento. Quando da persistência ou aparecimento de novos sintomas (dores de garganta graves, dores decabeça, náuseas, vómitos) ou em caso de febre associada, deve reavaliar-se a estratégiaterapêutica.Este medicamento não deve ser utilizado durante longos períodos de tempo sem conselho médico.Tomar Maxilase com outros medicamentosNão há conhecimento de relatos de interacções entre a alfa amilase e outros produtos medicinais.Informe o seu médico ou farmacêutico se estiver a tomar ou tiver tomado recentemente outrosmedicamentos, incluindo medicamentos obtidos sem receita médica.Tomar Maxilase com alimentos ou bebidasAconselha-se a toma de"
Para que serve Aldactazine?,"Não tome Aldactazine: se tem alergia à espironolactona, à altizida ou a qualquer outro componente destemedicamento (indicados na secção 6); se tem alergia a qualquer outro grupo de diuréticos (diuréticos tiazídicos) oumedicamentos utilizados no tratamento de infeções por bactérias (antibióticos dogrupo das sulfonamidas); se tem a função renal diminuída ou se não consegue urinar; se tem doença de Addison (deficiência hormonal caracterizada por fraquezaextrema, perda de peso e baixa pressão arterial); se tem os valores de potássio ou de cálcio no sangue elevados.Advertências e precauçõesFale com seu médico ou farmacêutico antes de tomar Aldactazine: se toma em simultâneo Aldactazine com certos medicamentos como diuréticospoupadores de potássio, medicamentos para controlar a pressão arterial [como osinibidores da enzima de conversão da angiotensina (IECAs)], trimetoprim outrimetoprim-sulfametoxazol, suplementos de potássio, substitutos do sal com grandequantidade de"
Quais são os efeitos negativos ao tomar Largactil?,"tratamento;Se é idoso: pode sofrer estes efeitos indesejáveis com maior frequência (ver secção 4). Sealgum destes efeitos ocorrer, consulte imediatamente o seu médico;Se é mulher e tem problemas de fertilidade (Dexcetoprofeno Elerdanite pode prejudicar afertilidade, pelo que não deve tomá-lo se está a planear ficar grávida ou a fazer testes defertilidade);Se sofrer de um distúrbio na formação do sangue e células do sangue;;Se tem lúpus eritematoso sistémico ou doença mista do tecido conjuntivo (alterações dosistema imunitário que afetam o tecido conjuntivo);Se sofreu no passado de doença inflamatória crónica do intestino (colite ulcerosa, doençade Crohn);Se sofre ou já sofreu de outras perturbações do estômago ou intestinais;Se está a tomar outros medicamentos que aumentem o risco de úlcera péptica ouhemorragia, como por exemplo esteroides orais, alguns antidepressivos (os do tipo ISRS,isto é, inibidores seletivos da recaptação da serotonina), os agentes que inibem acoagulação"
Quando não devo tomar Victan?,"para outra condição ou numa dosediferente da que está escrita neste folheto informativo. Siga sempre as instruções doseu médico sobre como tomar o medicamento.Se não se sentir melhor ou se piorar após 14 dias, tem de consultar um médico."
Quais são as precauções que devo tomar ao utilizar Aerinaze?,"branca, com a marcação “D12” na camada azul.Os comprimidos de Aerinaze são fornecidos em embalagens de 2, 4, 7, 10, 14 ou 20 comprimidos emblisters constituídos por películas laminadas com folha de cobertura.É possível que não sejam comercializadas todas as apresentações."
Como posso guardar Acabel?,"comunicarefeitos secundários, estará a ajudar a fornecer mais informações sobre a segurança deste medicamento.                                                  o                                                nã"
Quais são os efeitos colaterais de Cozaar?,"pode levar a colapso com perigode vida). Os indivíduos que manipulem rotineiramente as formulações em pó estãomais predispostos a desenvolver estas reações (ver secção 2).Se tiver quaisquer efeitos secundários, incluindo possíveis efeitos secundários nãoindicados neste folheto, fale com o seu médico ou farmacêutico."
Como devo tomar Blocan?,Blocan
Quais são os pontos de atenção que devo tomar ao usar Fortzaar?,"Não tome Fortzaar se tem alergia ao losartan, à hidroclorotiazida ou a qualquer outro componente destemedicamento (indicados na secção 6), se tem alergia a outras substâncias derivadas das sulfonamidas (ex. outras tiazidas, algunsfármacos antibacterianos (como o cotrimoxazol, pergunte ao seu médico no caso de terdúvidas), se tem compromisso grave da função hepática, se tem níveis baixos de potássio, de sódio ou níveis elevados de cálcio que não podem sercorrigidos com tratamento, se sofre de gota, se tiver mais do que três meses de gravidez. (Também é preferível não tomar Fortzaar noinício da gravidez – Ver secção Gravidez), se tem compromisso grave da função renal ou se os seus rins não estão a produzir urina, se tem diabetes ou função renal diminuída e está a ser tratado com um medicamento quecontém aliscireno para diminuir a pressão arterial.Advertências e precauçõesFale com o seu médico, farmacêutico ou enfermeiro antes de tomar Fortzaar.Deve informar o seu"
Quais são os efeitos desejáveis que posso ter ao tomar Lovastatina Azevedos?,"podem ser mais propensos a alguns dos efeitos mencionadosacima.Se tiver quaisquer efeitos secundários, incluindo possíveis efeitos secundários nãoindicados neste folheto, fale com o seu médico, farmacêutico ou enfermeiro."
Como funciona o Latuda?,Latuda
Para que serve o Luveris?,"Não utilize Luveris    se tem alergia às gonadotropinas (tais como, hormona luteinizante, hormona folículo     estimulante ou gonadotropina coriónica humana) ou a qualquer outro componente deste     medicamento (indicados na secção 6).    se tem cancro do ovário, do útero ou da mama.    se já lhe foi diagnosticado um tumor cerebral.    se tem aumento do volume dos ovários ou bolsas de líquido dentro dos ovários (quisto ovárico)     de origem desconhecida.    se tem hemorragias vaginais de origem desconhecida.Não utilize Luveris se qualquer uma destas situações se aplicar a si. Se não tiver a certeza, fale com oseu médico ou farmacêutico antes de utilizar este medicamento.Advertências e precauçõesFale com o seu médico, farmacêutico ou enfermeiro antes de utilizar Luveris.A sua fertilidade e a do seu parceiro devem ser avaliadas antes de iniciar o tratamento.Recomenda-se que Luveris não seja utilizado se tiver alguma condição que normalmente torna umagravidez"
Quais são os efeitos colaterais ao tomar Striverdi Respimat?,"doença, contribuindo paraminimizar os efeitos da doença no seu quotidiano.Para uma correta dosagem de Striverdi Respimat veja a secção 3. Como tomarStriverdi Respimat e as instruções de utilização no outro lado do folheto."
